Company Name,Description,Link
Connect Earth,"We are building the API-toolkit to calculate the carbon footprint of any purchase.

Companies and consumers are demanding more accurate data to reduce their emissions. We are building out the merchant- and product-level data infrastructure to empower consumers and companies to reduce their emissions.

We work together with Raiffeisen Bank, Qvalia, MoneyHub, Cogni amongst many others financial institutions and FinTechs globally.",http://connect.earth
Babaco Market,"Babaco Market is a subscription with which you receive out-of-the-ordinary fruit and vegetables at home. Products that do not exceed the beauty contests organized by traditional channels and which risk being wasted. We deliver them to your home, in a box. Bring all the goodness of nature to the table and reduce food waste!

A heart-shaped potato, a nosed eggplant, a kiwi or a Siamese cherry, these are just a few examples of what you will find in your box. But not only that, in each box you will also find products that are unique by nature because they come from small farmers who cultivate according to traditional methods and which safeguard the local Italian gastronomic tradition, unique in the world.

Ordering your box is very simple and you can choose between the Bonsai box or the Jungle box: different for quantity of products. Think about how much fruit and vegetables you eat and who you share them with and you will find out which Babaco Box is right for you! Curious? Order the first box and choose between a weekly or fortnightly subscription, but don't worry: you can unsubscribe freely when you want, without any problem.",http://babacomarket.com
SolarMente,"We make Solar savings simple for any homeowner by packaging together hardware, installation, warranties, financing, insurance, and continued tech support to bring out of pocket investment and risk for customers to 0. We are essentially producing trust and peace of mind in an otherwise jargony, regulation-heavy, sale to a non-technical customer.",http://solarmente.es
Rubi Laboratories,"At Rubi Laboratories, we turn carbon emissions into carbon-neutral cellulosic textiles for fashion brands with critical sustainability goals. Apparel is one of the top 3 dirtiest supply chains on Earth, and most major fashion brands have committed to critical and urgent sustainability goals amid consumer, investor, and supply chain pressure. However, brands are left frustrated with no scalable supply chain solutions despite some billions of dollars of investment per year. Our patent-pending technology sequesters carbon and produces carbon-, water-, and land-neutral textiles for apparel (~10 tons CO2 mitigated & sequestered per ton of textile, and ~0.4 GtCO2/year impact opportunity). Our textiles meet the needs of stakeholders across the fashion value chain: comparable costs to commercial textiles, easy manufacturing using existing viscose facilities, and properties which can mimic cotton, linen, silk, and wool. Today, Rubi is a team of 5 with expertise across science, business, fashion, and million-dollar-grossing product development. We have developed our lab prototype validating the core our technology, filed IP, interviewed 30+ potential customers and earned 2 LOIs, and attracted a stellar advisory board of leaders across science, business, supply chain, and fashion.",http://rubilaboratories.com
Sylvera,"Sylvera’s mission is to be a source of truth for carbon markets. 

Sylvera’s team of experts leverages proprietary data and machine learning technology to produce the most comprehensive and accessible insights on carbon projects. Backed by renowned investors and partnering with leading researchers at UCLA, NASA and UCL, Sylvera is helping corporate sustainability leaders, carbon traders and governments confidently evaluate the best, and most impactful, carbon credits to invest in.

By pioneering a much-needed solution and creating the first carbon intelligence platform, which provides independent ratings and market insights, Sylvera is raising the bar on project accounting and analysis, and introducing a much needed source of truth for carbon markets.",http://sylvera.com
EMAGIN (acq. by Innovyze),"EMAGIN provides water and wastewater facilities with an operational intelligence platform that supports real-time decision making when controlling critical processes. In doing so, we’re helping facilities reduce operational costs, enhance reliability and prepare for emergencies. Our intelligent control engine is designed to reduce energy and chemical usage resulting in OPEX reductions of 25-30%. Meanwhile, our early warning engine helps operational staff proactively identify and manage instrument or process faults. Lastly, our APM solution notifies operators about how assets are performing and when to optimally maintain them.",http://www.emagin.ca
Heirloom,"Naturally occurring minerals - alongside forests, soils, and the ocean - are one of our planet's most vital carbon sinks. Over geological timescales, carbon dioxide in the air and water chemically bind to these minerals and permanently turn to stone.Heirloom's technology enhances this natural process, called carbon mineralization, to help minerals absorb CO2 from the ambient air in days, rather than years. By combining the best of engineering and nature, they can offer the most cost-effective and scalable Direct Air Capture solution in the world.",http://heirloomcarbon.com
Journey Foods,"Journey Foods software enables food companies to quickly grow from new ideas, or new improvement, to commercialization by configuring desired consumer preferences, generating improved product formulations through ingredient tagging, receiving automated compliance and supply chain insights on nutrition and sustainability indicators. The solutions give management teams significantly faster data to make better strategic decisions and increase the ease of monitoring products for the 3 trillion dollar packaged foods market. The Journey Foods database retains an extensive and standardized database to extract data from millions of ingredients for algorithms to dynamically analyze and methodically recommend optimized portfolio recommendations based on pricing, supply chain, and nutrition parameters. To date, the company has established a database comprised of over 2 billion ingredient insights.",http://www.journeyfoods.com
Nilus,"There are over 2 billion people in the world who suffer from food insecurity. It doesn’t have to be this way if we consider that we waste over a third of the food that we produce in the world, while the food is perfectly edible, for reasons such as aesthetic or packaging defects, or because the food is about to expire. 

At Nilus, we have developed a digital platform that facilitates the sourcing of food products that are at risk of being wasted from producers and retailers, and we distribute them at 30% to 50% of their market price among soup kitchens in low income neighborhoods. We are currently operating in Argentina, Mexico and Puerto Rico, where we have delivered over 3 million plates of food to over 90,000 people.  Since COVID-19 broke out, we have grown over 1400% between March and June. 

Nilus was incubated at the Harvard Innovation Labs and received an honorable mention in Fast Company’s 2019 World Changing Ideas. Its investors include Google, Siemens and Marriott.",http://www.nilus.org
Mellizyme,"It's our vision to build a healthy, equitable and sustainable world, and we believe we can do this by making biology fundamental to every industry on earth.

Based off of 20 years of research by Professor Douglas Kell, CBE, we're building a computational platform for intelligent enzyme development. We take advantage of advanced AI and Deep Learning, combined with proprietary lab automation and genomic sequencing to intelligently navigate the vast search space of enzymes. This allows us to design and discover enzymes for any purpose, and in timelines to suit client need.

We have first applied this to solve the plastics crisis, and have developed a plastic-eating enzyme that enables the bulk breakdown of mixed waste plastics. This technology will enable the direct conversion of plastics into chemicals for use in polymer manufacturing, chemicals production and other industrial processes.

This technology also enables plastics to be utilised as a feedstock for bioprocesses, greatly improving the cost-competetiveness of biomaterials and specialty chemicals. 

Plastics are our first target, and we have plans to, and have already begun to tackle many other focus areas in health, the environment and industrial processes.",http://mellizyme.com
Ketos,"KETOS sits at the intersection of data science, IoT, and water automation. KETOS serves an array of industrial and agricultural enterprises, commercial businesses, institutions, cities & utilities, empowering them to make smarter decisions through real-time water intelligence and predictive analytics. 

Our innovative, patented hardware, and intelligent, interactive KETOS SmartFabric provides a robust software platform for predictive and actionable metrics - delivering the tools & insights needed to optimize water usage, ensure resource sustainability and provide water safety assurance.",http://ketos.co
"Checkerspot, Inc.","Checkerspot is a materials company. Our innovation platform enables the design -- at a molecular level -- of new high performance materials, starting with next-gen polyurethanes and textile coatings/finishes utilizing building blocks (such as triglycerides and fatty acids) never available before at scale that can impart unique high value physical properties for materials. Our approach is also more sustainable than relying on petrochemical inputs.",http://checkerspot.com
Minimum,"Minimum’s hybrid solution of cutting-edge sustainability software supplemented by best-in-class human know-how helps businesses achieve their sustainability goals fast.

We leverage the powerful scaling effects of our sophisticated technology to empower our world class in-house experts to focus on impactful, high-value analysis and advice, getting companies up and running with an all-important baseline carbon footprint and reduction strategy in a matter of weeks, not months.

Our software tool is a holistic carbon management platform. It streamlines the data collection process, automates the calculations and displays the output reports. The flexibility of our data collection software allows us to customise the data collection process to each specific customer's needs. Our carbon calculations combine each customer's input data with the most appropriate emission factors, pulling from multiple datasets including leading government data sets, scientific reports and our own proprietary data. Where necessary we also fill gaps in the data with benchmarks and estimates that we are able to make from across all the companies we have previously footprinted. Our dashboards and reports are generated using the outputs of the calculations and a overseen by our sustainability experts.",http://minimum.eco
Helios,"We want to respond to environmental challenges and bring about a sustainable economy that respects the Planet. Together let's create an alternative, transparent and low-carbon bank.",http://helios.do
Circulor,"Circulor is using blockchain, IoT and AI to bring transparency to materials supply chains. The Circulor platform tracks raw materials from source to finished product, helping manufacturers and their suppliers build a sustainable future.

Circulor's clients' raw materials concerns range from cobalt to palm oil to plastics recycling. Materials are given a dynamic identity which is the basis for a complete chain of custody, even as their composition changes during refining and amalgamation. They help customers to demonstrate responsible sourcing, to monitor inherited emissions from the supply chain and to underpin their circular economy ambitions. They help procurement and sustainability professionals see and manage what previously was invisible.",http://circulor.com
Greyparrot,"At Greyparrot, we provide waste recognition software that identifies materials using AI-based computer vision to monitor, audit and sort waste at scale. Our goal is to empower waste managers with actionable insights to increase recycling rates. Our first product, an Automated Waste Monitoring System, is currently deployed on moving conveyor belts in sorting facilities to measure large waste flows. The system provides waste analytics to increase resource capture, give quality guarantee to buyers and mitigate against risk. We are committed to unlocking the financial value of waste, which will, in turn, support our transition to a circular economy and keep our environment clean for generations to come.",https://greyparrot.ai
rePurpose Global,"rePurpose Global is the world's leading Plastic Action Platform making positive environmental impact accessible for anyone, anywhere. Our one-stop solution empowers purposeful people and companies to go Plastic Neutral by meaningfully reducing their plastic footprint and financing innovators solving for our planet's future.Through rePurpose Impact Projects across 3 continents, we are creating systemic change for people across 26 countries and hundreds of conscious brands, including Grove Collaborative, AB InBev, The Hut Group, Google, Dalberg, and Colgate. On behalf of this global coalition, we eliminate millions of pounds of plastic waste from nature every year, and in doing so, improve the lives of 9,500+ marginalized waste workers worldwide.",http://repurpose.global
ByFusion,"The plastic recycling industry is facing extreme challenges. Costs of operations are skyrocketing due to an increase of non recyclable plastic packing, high contamination rates and decrease of secondary markets for the non recyclables is forcing recycling center to landfill more plastic than ever which has devastating downstream impacts.",http://byfusion.com
Litterati,"Litterati is an environmental intelligence company on a mission to eradicate litter. Used by schools, cities, and brands, the company's technology empowers people to clean the planet, while simultaneously building a Global Database of Litter. Litterati is backed by the National Science Foundation, in partnership with the United Nations, and was highlighted at TED.",http://litterati.org
BetterYou,"BetterYou helps people find more time in the day to do what matters to them. Through no manual entry, behavior design in the user interface, and personalized nudges, members benefit by being engaged and supported to set and pursue physical, mental and social wellness goals.
Today the time we spend on our devices is optimized not for what we want, but for what we'll watch. BetterYou is creating a world where your time isn't controlled by app makers or advertisers, but you.
We are currently leveraging a B2B2C model. Better You serves the higher education and commercially insured/ employer sponsored insurance market with other technology partnership opportunities in discussion. Higher education benefits from students using their time effectively because ineffective time utilization impacts retention of students. Improved employee health and wellness impacts health insurance premiums in addition to improved culture, productivity, recruitment and retention of talent.
BetterYou has grown MRR Commitments in enterprise, higher education and  partnerships, tripling revenues in 2020 and growing them by 2.5x in 2021. Today our  monthly recurring revenues are on pace to end the year at $200,000 and see that  number double again in 2023.",http://betteryou.ai
Plutoview,"Plutoview allows you to use your favorite apps and tools with anyone in the Metaverse. Our mission is to create a world where everyone has equal access to the tools that help them become successful in work and in life.  Work together again with all the tools and applications necessary to achieve our goals.  Shop together again at any and all of your favorite online retail locations and shop for and create NFTs, mirroring the functionalities of an in-person retail space.  Book trips together, completely virtually, with your significant other, classmates and coworkers.  Relax and watch movies and TV shows, with the highest quality audio and video, in a virtual theater with all of your friends.",https://www.plutoview.com/
Adrich,"What if your product could communicate its usage patterns and tell you when it’s time to re-order? With Adrich, brands can readily convert any consumable products or packaging into connected products with its peel-and-stick smart sensing labels that autonomously capture real-time usage data. Brands and retailers can leverage the insights on how their consumers use their product to increase loyalty and LTV. With behavior data such as when consumers are running out of product and ability to engage in a 2-way communication with consumers, brands can offer personalized experience at scale. Adrich’s solution is used in a variety of use cases such as consumer insights, smart packaging, media effectiveness monitoring, regimen building, smart replenishment, and automated refill for sustainability and connected ecommerce.

The female-founded and led company is headquartered in Pittsburgh and counts some of the leading consumer brands and retailers as customers, including Clorox, Colgate, and Tyson.",http://adrich.io
Wareclouds,"Wareclouds puts brands products in their customers hands in a fast and cheap way, by using people idle space and time. This people store products and pick and pack orders in their house, which are then delivered by people in their car.

We use a sharing economy model, where people in their homes take care of the fulfillment, and independent riders of the last mile.",http://wareclouds.com
Syncware,"SYNCWARE provides software to connect robots, barcode scanners, label applicators, with warehouse management systems in hours instead of months. SYNCWARE translates all robot languages to one common standard. We build on top of state of the art open source interoperability framework, making robotic connectivity possible.",http://syncware.ai
DreamQuark,"DreamQuark’s efficient, user friendly software solution, Brain, is designed to help Wealth Managers grow smarter. It generates highly personalised insights in an instant that empower advisors to meet specific growth objectives and create exceptional experiences for any client.DreamQuark’s AI specialises in improving specific growth targets, such as cross-selling and up-selling, which have a real world, measurable impact on a client’s experience and a wealth manager’s bottom line.Their software places powerful insights directly in the hands of the people clients trust most – their relationship manager. Now they can get closer to every client by making highly personalised recommendations.Our platform Brain simplifies and automates the creation and maintenance of customer insights. By generating recommendations in a few clicks, advisors can put data into action.Brain is used by major banks and insurance companies that trust it to grow their revenues, increase loyalty but also improve compliance and reduce the cost of risk.",http://dreamquark.com
Sila,"Finance is a $13 Trillion industry globally, and it's being disrupted by a new wave of innovators who are building customer focused solutions using modern technology. But today’s fintech and crypto startups struggle to find compliant ways to verify customer identity, move money, or hold customer funds. It often takes them years and millions of dollars just to build and ship a product. Sila is an API platform that solves these problems and allows developers to rapidly build financial applications and bring them to market. Initially we offer 5 critical APIs: ID Verification, Link Account (using Plaid), Issue Sila via ACH, Redeem Sila via ACH, and Transfer Sila via Ethereum.",https://www.silamoney.com/
Even Financial,"Founded in 2014, Even Financial is a B2B fintech company that is transforming the way financial institutions find and connect with consumers, enabling any company to add financial products to their business. As the leading search, comparison, and recommendation engine for financial services, Even seamlessly bridges financial services providers (such as SoFi) and channel partners (such as TransUnion) via its simple yet robust API and embeddable solutions. Even turns any consumer touchpoint into a comprehensive financial services marketplace with full compliance and security at scale. Even was named one of ""America's Best Startup Employers'' by Forbes for 2021 and placed in the Top 50 of the 2020 Deloitte Technology Fast 500, which recognizes the fastest growing tech companies in the world. The company is backed by leading financial services firms and VCs, including American Express Ventures, Canaan Partners, Citi Ventures, Fidelity’s F-Prime Capital, Greatpoint Ventures, Goldman Sachs, LendingClub, and MassMutual Ventures. Learn more at www.evenfinancial.com.",http://evenfinancial.com
TenureX,"Our mission: We enable creating and running smart, controlled, and transparent correspondent banking relationships between FI's. 
The challenge we solve: Banks and Financial Institutions want to process and execute more wire transfers between them; however, they cannot correctly and efficiently manage the risks associated with this partnership because of how wire transfers are processed.

Our solution: TenureX is unbundling the existing relationships into its core unit: The Transfer. Then, reassembling these relationships back to look & function to the same methodologies the organizations have in place, providing a complete streamlined, controlled process without affecting the operations, compliance, and RBA.  

Our broad use cases offer:
Enhanced Onboarding process – we do 80% of the heavy lifting and leave you with the actual work of assessing a partner.
Real-time RMA updates – we update the FI's profile based on its actual risk in real-time and enable better RMA updates.
Enable Growth – With the TenureX platform, you will build a better business with a broader client base and fewer resecures
Enhanced User experience  - Our solutions are built to enable transparency and predictability while allowing better service to the FI's clients at all levels",http://tenurex.com
Coin Homes,"Better Future Technologies is the holding company of Coinhomes and Piggy, which combined provide a seamless end-to-end experience from finding a home to getting a mortgage. Eventually users will be able to buy real estate around the world with Bitcoin in under 1 day.

Piggy is a neobank for individuals and companies holding Bitcoin. Piggy offers clients: Bitcoin checking/savings accounts, Bitcoin collateralized loans (mortgages and auto loans), and the ability to receive checks from any employer and pay bills in Bitcoin. Piggy has received a 100M debt facility (flexible interest rate of around 7%) to begin lending.",http://coinhomes.com
Agency,"Agency is the most comprehensive digital security suite available to individuals. Our subscriptions are affordable and simple for users to set up and include 3 core parts:
-Advanced software for every device
-24/7 Live Monitoring and Response by US based professional
-Over $1M of coverages for personal cyber, loss of funds, and ID theft

We sell to consumer online, with insurance companies, and to employers as a company benefit.",http://getagency.com
Semantic Health,"Semantic Health is a Toronto-based healthcare technology company leveraging proprietary artificial intelligence to help hospitals improve their medical coding, auditing, and CDI processes.",http://semantichealth.ai
Syndi Health,"We want to transform the way digital health services are evaluated, adopted & reimbursed through an integrated digital gateway to effective and safe digital health services that everyone can access and afford. 

Digital therapeutics, wellbeing apps and telehealth services have lowered barriers for patients seeking help, however, the digital health app market has become saturated, and users do not know what to choose. Of the 20k+ mental health and wellbeing services now on the market, only 2% have proven clinical benefits. When a user does try one of the mental health and wellbeing apps, there is no structured process to evaluate the clinical efficacy of the service, for that user. There is an urgent need for new reimbursement mechanisms to drive digital therapeutic adoption and payment by outcome and usage.

Syndi provides customers with an integrated, personalized digital care recommendation platform, complete with anonymized population analytics, embedded within their existing web services / apps. Syndi’s medically approved and patent-pending platform evaluates, recommends and drives adoption of health apps and digital therapeutics. Syndi uses machine learning to recommend services to users from a ranked and clinically reviewed formulary of partner digital health solutions.",http://syndi.health
Fig: Food Is Good,"FIG is an early stage, venture-backed technology company improving the world's health through food. FIG's Food-First Care platform improves broken care journeys around food and health by bringing personalized diet recommendations to the forefront of care. 60,000 members are currently managing their conditions on FIG.",http://foodisgood.com
