Company Name,Description,Link
BIOWEG,"Founded as Cellulosic Technologies (now BIOWEG) in 2019 in Germany, they are a purpose-driven organization powered by conscious ChemDesign. They match BioInnOvation to business problems. They explore and combine biotechnology, material science, and molecular simulation learning to create and sell advanced sustainable and bio-based high-performance ingredients. Their ingredients are 100% animal- and GMO-free, globally scalable, and sustainably produced without using any harsh chemicals.

We work with results-oriented, forward-thinking companies and consumer brands with global scale in the beauty, nutraceuticals, and food/beverage sectors who desire highly-differentiated, 100% animal-free and sustainable, science-based ingredient technologies. 

We bring to you biodegradable and clean ingredients made with bacterial cellulose. Our portfolio includes bio-based and customized microbeads, biodegradable rheology modifier, bio-based and highly functional hydrocolloid.",http://bioweg.com
Titan Bioplastics,"As a sustainable material engineering company, Titan Bioplastics adapts existing and initiates original sustainable materials - including nano technology  additives - into a variety of resins and composites. Titan has the solution to maximize the commercialization of a wide variety of healthy polymers. 

We have three core company initiatives:

1. We develop client driven projects - where clients come to us to solve a material mechanical or structural issue,  or request production of a new material composite that needs to function to target specifications.

2. We develop Proprietary Innovation projects - This is where we see a market niche, produce a material/composite which we own, manufacture and take directly to market ourselves. Like Augie Bones (www.augiebones.com) The pet industry's first tough bioplastic chew toy for dogs. Our 2023 market innovation is in Ag Tech.

3. We develop nano technology additive systems for various applications, including water and oxygen barrier.

Our expertise spans, but is not limited to: coatings, polymer composite development, nano barrier technology, the use of graphene oxide and graphene resin composites and masterbatches, pilot compounding, material testing, bioremediation and energy capture technology.",http://titanbioplastics.com
LAM'ON,"LAM’ON is a biodegradable and suitable for composting laminating film. It offers the same results as the currently used ones and even using the same machinery. What makes it stand out is it’s composting properties of both film and glue.

It is derived from renewable resources like corn. The glue layer that we developed specifically for the needs of the industry is completely toxic-free. It is also water soluble in order to ease the recycling process. 
On top of that our production method is simplified in a way that saves us time and money.

LAM’ON offers the same results, is used on the same machines, and is offered at the same price range as the currently used laminating films. During the development of the product we received a big amount of inquiries for a packaging foil as well. And so another product was born - PACK'ON.",http://lam-on.com
Phaxtec,"Combating plastics pollution requires innovative alternatives and PolyHydroxyAlkanoates (PHA) are the most appropriate alternative to plastics due to them being marine, fresh water and soil biodegradable, recyclable, and home and industrially compostable. They are being produced commercially in small scale and have been thoroughly validated in 100’s of applications for 40+ years.
 
PHAXTEC, Inc. would use Biogas, an abundantly available GHG, be cost competitive to plastics and enable recycling, and home and industrial composting, eliminating landfills. PHAXTEC uses proprietary microorganisms and patented and commercial production and applications technologies to ensure competitive advantage.  Priority markets include a) foodservice paper coatings - enable packaging to be either recycled for the cellulose or composted - and b) slow-release fertilizer coatings  - allow reduced fertilizer usage without losing yield, reduce fertilizer leaching into the waterways to reduce Algae Bloom and Red Tide.  The PHAXTEC® team is successfully bringing together hi-tech development, manufacturing and traditional markets positioning PHAXTEC® to be a leader in transitioning the industry to circularity and sustainability.",http://phaxtec.com
FunCell,"FunCell is a company that provides biobased additives for paper, boards and nonwoven industry : 
- Packaging
- Hygiene papers
- Specialty papers
- Cardboard industry

Our product:
- BioWet: reinforces paper mechanic x2 when dry and 20x when wet. It allows paper manufacturers to save 30% of primary material.

We are using a natural polymer extracted from biomass. The additive is non-toxic! We are in the process of getting the food contact approval.

The beauty of our additives is that they are increasing the mechanical strength of the treated paper and at the same time they do not hinder recyclability. A paper treated with BioWet can be “repulped” to make new paper. Paper manufacturers directly integrate the additive in their processes - it react with the cellulose naturally by forming a chemical liaison to reinforce the paper. 



We already have proven our additive efficiency with top-tiers customers in Europe. We are located in Grenoble (French Alps) in a region that used to be the heart of the paper ecosystem and even if this Industry has now vanished, the paper ecosystem in the region remains very active and FunCell is a living proof of it.",http://funcell.fr
Gig and Take,"Gig and Take developed a workforce management software intended to reimagine the future of work in industrial manufacturing and logistics. The company aims to change the work culture of factories and manage a flexible workforce by increasing diversity, reducing mandatory overtime, and operationalizing flexibility, thereby breaking the century-old construct of rigid work schedules and unlock disproportionately diverse talent pools to work in a key sector of the economy. 

GAT also handles the integration process, making it easy for factories to easily schedule the flex workers with their full time workers. Current pilot customers including Michelin and Carlisle Industries who both jumped at the opportunity to complement their labor force blend.

Gig and Take is reimagining the future of work in Industrial Manufacturing and Logistics. Gig and Take believes the future of work is flexible and that factories and warehouses are no longer an exception.",http://gigandtake.com
intramotev Autonomous Rail,"They are developing a self-driving rail vehicle that enables a point-to-point freight transit model, eliminating the time and costs required to gather and pull static railcars with a locomotive. By putting the motive power in the railcar itself, they can reduce the shipment size and route distance typically required for railroad profitability and enable better competitiveness with trucking .Each year in the US alone, goods worth over $690bn are moved by a fleet of 1.6 million railcars. On any given day, 900,000 of these railcars don't move at all. And on every single leg of its journey, a loaded railcar will sit idle for an average of 24.6 hours - just waiting for a locomotive. Rail’s inefficiencies push many shipments to trucking, which is bad for society. Trucks emit 9x more GHGs per ton-mile than rail, add congestion to roads, and contribute to deadly accidents.

intramotev is building a future where no railcar needs to sit idle waiting for a locomotive, and not a gallon of diesel is burned to move them.

Their autonomous zero-emissions vehicles are revolutionizing the future of freight in applications such as mining, intermodal, port, and other industries.",http://intramotev.com
Kardinal,"The company's platform uses AI and offers automatic dispatch, pick up and delivery support, routing optimization, static and dynamic delivery management and time prediction of courier arrival. Their solutions assist your operational teams on a daily basis by dynamically adapting tour plans according to exogenous shocks (breakdown, traffic, schedule changes, etc…). Their algorithms are constantly looking for the best solution, taking into account the new information that arrives in real time. The company provides an accessible SaaS solution easy to use for complex transportation tasks. By relying on technological supports (smartphones, cloud services, etc.), the intelligence system artificial integrates completely with the logistics processes put in place in transportation companies and allows them to respond more quickly and effectively to all problems encountered.",https://kardinal.ai
Faction,"Founded in 2020, Faction develops driverless electric vehicles that have the speed and performance of cars, but at a fraction of the cost. Our combined team has engineered driverless systems from light electrics to large semi trucks, and we’re taking a new approach.

Faction uses three wheel vehicles that are regulated as motorcycles making them faster to develop and “right sized” for typical urban deliveries and trips. We combine autonomy with remote human supervision, so we’re not constrained by waiting for 100% autonomous technology.  To us, autonomy is an optimization, driverless is a product.

To start, we’re focusing on less than truckload delivery, and vehicle-on-demand, where you can summon a vehicle and drive it yourself.  In all cases, we can beat the cost of human driven fleets.

Faction's patent-pending DriveLink™ and TeleAssist™ technologies allow us deploy driverless solutions on a range of vehicle platforms in a safe, reliable, and scalable manner.",https://www.faction.us
Qualle,"Qualle was established in late 2019 and just launched their soft beta in 2021 with Maersk. Qualle is building out a street turn automation tool, targeted at truckers to request the reuse of containers with shipping lines. A street turn is when a carrier uses a container from one trip, and instead of bringing the empty container back to the rail, they use it for a pickup. The carrier makes money from both loads while running less miles. 

Qualle takes an outdated process of communicating with the Steamship Lines to effectively facilitate Street Turn requests, while empowering truckers to do more by connecting fragmented dots between all stakeholders within the ecosystem. Their software helps with container triangulation to match import containers with exporters demand. Right now navigating and booking street turns is a very manual process and can take hours finding, uploading and negotiating prices through email. With Qualle’s first product “V1” you can do it all on one dashboard within minutes. Qualle has two more products coming to market “V2” that helps with container triangulation through an empty container marketplace for truckers and “V3” that integrates with importers and exporters to help build out the entire street turn ecosystem.",http://qualle.co
Freightpay,"Freightpay is building the future payment layer dedicated to global logistics. Our goal is to increase the speed and efficiency at which the supply chain transacts. The Freightpay platform will digitize payments to enable faster, more connected financial transactions. The system will also provide dispute resolution and more intelligent exception management for all payment functions. Resolving payment issues more efficiently, while identifying problematic transactions, will give executives superior financial intelligence and more control over cash flow.",http://freightpay.io
Carbmee,"Carbmee accelerates your decarbonization and empowers your operational teams to take science-based actions on scope 3. Carbmee's solution uses science-based methodologies for a detailed comprehension of your corporate greenhouse gas emissions. Detect reduction potential, automate your workflows, collaborate with customers & suppliers and track your progress in common reporting frameworks.

The Environmental Intelligence System is a software platform that guides your enterprise through the most critical business challenge of all time - increasing profit and decreasing emissions, at the same time. It is built to assist operational teams with a workflow-based experience for making profound decisions based on specific data. The Environmental Intelligence System guides your enterprise to net-zero.",https://www.carbmee.com
bops,"bops is a headless, supply chain intelligence platform helping manufacturers and distributors source, make, and deliver their products. By powering data applications, bops provides operators with end-to-end supply chain visibility and continuous insights to make daily decisions and unlock working capital.",https://www.bops.ai
"Soapbox, Inc.","Soapbox is an e-commerce command center for your fulfillment operations. Our solution covers your end-to-end needs, from storefront listing and order management, to inventory reconciliation, warehouse, and shipping management. The software is designed for, and as, a best-practice fulfillment workflow to get your products to your customers easier, quicker, and more cost efficient.

Best of all, Soapbox is FREE for startups and small businesses.",https://www.soap-bx.com
icustoms,"Developer of a customs clearance platform intended for companies and customs agents to electronically file customs declarations with greater accuracy. The company's platform is based on AI and ML and does not include any third-party agents or middlemen, includes smart processes tailored based on the company's profile, less manual work, and more business, enabling businesses to make their customs declarations directly.",https://www.clearcustoms.io
TO THE MARKET,"TO THE MARKET is the turn key solution for ethical manufacturing and sourcing of apparel, accessories and home goods. Through our syndicated network of suppliers, we work with Fortune 500s, brands and retailers to provide story-rich products that appeal to the next generation of consumers with transparency, sustainability and authenticity. We enable the supply chain of the future, in which retail manufacturing empowers people, protects the planet, and delivers quality products that result in a better bottom line.",https://www.tothemarket.com
EAIGLE,"We are a human-centric AI and ML company developing enterprise computer vision solutions for the workplace and public spaces. Our solutions enable customers to optimize processes, reduce costs and grow revenues.

We work with global enterprises in a wide range of sectors including retail, supply chain, logistics and commercial real estate.  Our technology enables our customers to identify inefficiencies in their operations or breaches in their policies all in real-time notifications or alerts.  

What's Unique About Us:  
1-Our technology is hardware agnostic; this means we can work with existing cameras and sensors reducing our customers’ capital investment when deploying our solutions enterprise wide.  
2-Our technology processes inputs from optical cameras, infra-red and radar sensors.
3-Our technology has superior accuracy which eliminates false positives and interruptions to operations

Access Control Solution
To ensure only the right people get into your facility, we developed a robust check-in and check-out software housed in a heavy-duty kiosk. The system automates the registration process for employees, visitors, contractors, and packages. For added security, the system comes with the capability tointegrate with your access control system to unlock doors.",http://www.eaigle.ai
WARP,"Warp connects shippers, carriers, and facilities to find the most efficient route for middle-mile freight. The first freight network of its kind, Warp weaves together digital pooling, back-hauls, and physical consolidation points (Warp Stations), to provide shippers with a cost structure for shippers previously unthinkable with old school trucking companies.",https://www.wearewarp.com
Allosense,"Allosense delivers an easy user experience for integrating smart sensors and analyzing data, by designing and manufacturinng ""always connected"" asset trackers that use satellite, cellular, and mesh connectivity. Allosense trackers incorporate a suite of sensors for monitoring high-value assets in real-time.

Allosense specializes in high-volume test and measurement solutions for both commercial and military applications. The team works with large industrial partners and integrate turnkey measurement solutions for improving quality and yield of electronics while reducing time-to-market of new product introductions.",https://www.allosense.com
CTHINGS.CO,"CTHINGS.CO develops and manufactures end-to-end 5G IoT solutions designed to uncover the hidden potential in processes and assets. There’s much more to processes and assets than the naked eye can see.  

Even the simplest actions and seemingly trivial objects are glowing with impressive amounts of data that can be the key to higher efficiency, lower costs, and sustainable growth. 

The company is in the business of developing reliable and user-friendly 5G IoT solutions that allow their customers to make better decisions based on precious data hidden in multiple aspects of their businesses.  

CTHINGS.CO designs, develops, and manufactures 5G IoT hardware, software, sensors, cloud platforms, and web applications. Their solutions employ cutting-edge technology and components to monitor, capture, transmit, and analyze massive amounts of data in near real-time.   

The organization supports the digital transformation of industries and municipalities with an end-to-end approach and offers a solution portfolio of 5G connectivity infrastructure, asset tracking sensor networking, and remote distributed monitoring that can be combined, customized, and adapted to cover even the most specific use cases.",http://cthings.co
Transparent Path,"Transparent Path is a social purpose corporation focused on supply chain visibility. Our mission is to reduce food waste and financial risk by creating a more agile, efficient, and predictable supply chain.

Powered by IoT sensors, blockchain security, and artificial intelligence, Transparent Path’s secure, scalable platform provides food manufacturers, processors, logistics partners and retailers with the ability to see and act on supply chain issues in real-time. As a result, Transparent Path’s customers know immediately when something goes wrong, can act to prevent risk, and can anticipate supply chain issues before they occur.",http://xparent.io
UrsaLeo,"UrsaLeo is a platform as a service technology company that enables companies to visualize operational data in a 3D representation of the facility. Backed by a powerful end-to-end IoT platform, UrsaLeo Cloud, UrsaLeo displays data from multiple systems to create a digital command center for all facilities information. Pulling in data from sensors, assets databases, and other IoT systems, the UrsaLeo 3D system zooms automatically to user defined events, allows recording and replay of the entire system during failures, accelerates triage response time, and eliminates training needs. UrsaLeo was founded by manufacturing and software engineering experts with more than 50 years of industry expertise. UrsaLeo was founded on 2017 by manufacturing and software engineering experts and is headquartered in San Francisco, California. audit.",http://www.ursaleo.com
Carpe Diem Solutions,"Carpe Diem Solutions is an IoT company and a specialist in ML-based edge computing which innovates, designs and engineers real-time and ALFA*-powered sensor-fusion and digital signal processing technologies for connectivity, movement tracking, precise positioning and navigation. Our solutions empower industrial, commercial and professional applications such as 5G broadband, 3D motion capture/tracking in animation, sport, VR/AR and biomechanics, indoor location, robot/drones orientation, industrial control & stabilization, radar systems, etc. 

*ALFA -  Adaptive Lattice FIlter Algorithms",https://www.carpe-diem.solutions
Really-Virtual,"Really-Virtual provides a modern way to staff and train equipment-based operators using our Real-Forklift virtual reality simulator. Schools, workforce development organizations, and companies utilize a mix of authentic physical controls, virtual reality software, data collection and analytics to onboard, train and maintain forklift operators.

For 2023, Really-Virtual aims to launch BluWorkz. BluWorkz will address labor shortages, by engaging potential jobseekers that have been disenfranchised or marginalized in the workforce, by offering assessment, training, and job placement at zero cost.  By leveraging our partnerships in education and workforce development, our network of Real-Forklift simulators will attract and qualify untapped talent expanding the labor pool for employers.",https://www.really-virtual.com
Fulfilld,"Fulfilld is the next generation of intelligent warehousing management software. 

Via patent-pending location-awareness (5G/UWB) digital-twinning, AI/ML-powered system-driven Ops optimization, integrated Fulfilld handheld scanners, and holistic orchestration capabilities of system-directed tasking between human and connected systems (robots, ASRS, vehicles, etc.) , Fulfilld optimizes core warehousing operations by reducing wasted warehouse worker activity by 40%; improving inventory accuracy by 24%; optimizing product placement by 18%; and improving warehouse worker efficiencies by 80%.  

It's time to get Fulfilld.",http://fulfilld.io/product-overview
WORKERBASE,"WORKERBASE helps manufacturing companies to make their workers more productive by up to 50%.

We have seen that, while some companies have already done digitalization projects, they have missed to create a modernized way of how humans work. Manual work is still divided into static jobs and coordinated using paper and human supervisors. This leads to a lack of transparency and a long cascade of everyday problems. These problems lead to millions of Euros being wasted in every manufacturing company. 

We have created a new way of working which breaks monolithic jobs/roles into smaller portions of skills. One job can become 100s of individual skills and workers can constantly acquire new skills using a digital training system. Work is then allocated in realtime based on these skills which allows clients to utilize the time their staff previously had nothing to do in their jobs. Combined with a system of prediction algorithms, we are able to save €3.6m annually for an average factory.",http://workerbase.com
The Predictive Company,"The Predictive Company has developed an energy efficiency software that saves up to 30% of energy and CO2 emissions and can be implemented in any type of a commercial building.

The software connects the data of a building with external and internal variables to create its digital twin and make an accurate prediction of its energy need with the end of an autonomous and optimized operation of HVAC machines. (heating, ventilation, air conditioning).

Additionally, as the technology is based on self-learning algorithms, the software is able to detect small machine failures before they become a serious problem, therefore, the software also provides a predictive maintenance solution.
Therefore, 2 solutions (energy efficiency and predictive maintenance) in 1.

The Predictive Company is a spin-off of the Polytechnic University of Catalonia and it has been founded through the ""The Collider"" program, a pioneering tech-transfer program of the Mobile World Capital Foundation.",http://thepredictivecompany.com
Industrial Analytics,"(Acquired) Industrial Analytics IA GmbH Industrial Analytics provides plant and machine monitoring software for rotating machinery as a combination of acoustic and vibration measurements with physical models and AI. The hybrid solution is a combination of edge computing and analytics software, which can be integrated into any IoT platform. The aim is to obtain transparent, deterministic, and localisable results with clear instructions for action, and above all no more false positives and false alarms. The results are far more efficient monitoring with more machines per monitoring staff and reliable predictive maintenance.",http://industrial-analytics.io
Plunk,"Plunk’s advanced analytics revolutionize the way homeowners, home experts, and investors value and invest in residential real estate—through the power of AI, machine learning, and image analysis. Plunk tracks an individual home’s price in real time and represents a new level of both comprehensiveness and transparency. Plunk’s real-time solutions are accessed by consumers, real estate professionals, and the investment community via a suite of data and software products, across both web and mobile platforms.

Plunk was co-founded by Brian Lent and David Bluhm, two tech startup veterans who have played integral roles at some of the world's most innovative companies.​

With their combined experience, our founders are building a new evolution of housing analytics. And with a world-class team of data scientists and engineers, they are bringing next-generation Artificial Intelligence and machine learning algorithms to the residential real estate industry.​",https://www.getplunk.com
