Company Name,Description,Link
Quickly,"Quickly is an earned revenue access technology that lets small and medium sized businesses (SMBs) take control of their working capital by providing next day access to their verified receivables. They provide a platform that streamlines the relationship between buyers and sellers while matching enterprise level capital providers, like banks and institutional lenders, with SMB’s that would not normally have the capacity to access these resources.",https://www.helloquickly.com
MachEye,"MachEye’s AI-powered BI platform offers natural search, click-less intelligence, and interactive audio-visuals to improve the speed of decisions, uncover business opportunities, and increase user engagement. MachEye ensures a single source of truth through zero data duplication, and simplifies the on-boarding process with an automated data catalog.

Simply put, MachEye makes data analytics stress-free, instantaneous, and insightful for every business user.",https://www.macheye.com
Personify XP,"Personify XP automates digital experiences for anonymous digital shoppers driving an average increase of 10% in revenue. Personify XP partner with some of the world’s most exciting brands like Farfetch, Boohoo, Pentland Brands, Lovehoney and Vitabiotics. A Gartner Cool Vendor in Personalisation, Personify XP delivers ‘personification’ solving the ‘cold start problem for personalisation’.
 
Personify XP is able to personalise in real time onsite shopping behaviour by identifying the purpose of the shoppers visit completely anonymously. Personify XP’s proprietary AI dynamically inserts content and products based on shopping context without business user involvement. Changes in behaviour, driven by celebrity endorsements, discount and new product launches are recognised automatically in real time, updating/creating new behaviours to drive highly personalised experiences.
 
With GDPR, CCPA and Google phasing out 3rd party cookies in 2022 we deliver exceptional experiences today.",http://personifyxp.com
Membird,"We created a fast and user-friendly solution that helps organizations retain and engage their community members.  We enable any company to create unique memberships in Apple & Google wallet and use AI-powered push notifications to increase customer engagement, retention, and LTV. Create dynamic mobile wallet cards with ""Linktrees"" and send push notifications - without an app.

Product Demo and Info:
https://docsend.com/view/29kpsru3sirqq3ac",https://www.membird.ai
Ombre,"Ombre has sequenced over 90,000 consumer microbiomes, and converts microbiome test takers to probiotic consumers, the majority of whom subscribe. Consumers love Ombre’s personalized digital experience and premium targeted probiotics. Ombre is launching at retail in 1000 CVS Health Hub stores this year. The company is on plan to reach profitability in 2024.",https://ombrelab.com
Monitaur,"Monitaur's Machine Learning Assurance Platform helps companies build and deploy responsible AI and machine learning models that business leaders, regulators and consumers can trust. The platform’s integrated products – GovernML, RecordML, MonitorML, and AuditML – drive cross-functional collaboration and automation to deliver transparency, fairness, safety and compliance for high-impact systems across the full model development lifecycle.

Founded in 2019 by a team of deep domain experts in the areas of corporate innovation, machine learning, assurance, and software development, Monitaur is committed to improving people’s lives by providing confidence and trust in AI. For more information, please visit https://www.monitaur.ai, and follow us on LinkedIn at https://www.linkedin.com/company/monitaur.",https://www.monitaur.ai
Stere,"Stere, a tech platform, enables businesses to build and provide insurance solutions to their end-customers. 

It works like this: Stere provides a single API for your platform to start offering any insurance product to your end-customers, while building intelligent tools and infrastructure in the back-end including finding the right insurance partners, creating API driven capacity, and great customer experiences. 

With Stere, it’s now possible to offer any insurance product through a single API, while generating additional revenues.

Without Stere, companies don’t have a simple way to embed insurance, don’t have end-to-end infrastructure, don’t have the network and expertise to find the right insurance partner, or simply are unaware of the business opportunity.",http://stere.io
InSite Health,"InSite Health is redefining outpatient psychiatry for children and adults. InSite provides local communities access to in-network, high quality psychiatric care. We meet patients where they are: at home, at school, or at one of our convenient locations.

We offer psychiatric care to families, schools, nonprofits, colleges and organizations throughout New Jersey and Pennsylvania.

InSite employs full-time providers that are board certified to administer psychotherapy and more advanced therapeutic interventions. All providers have advanced training in psychopharmacology and medication management.",https://insitehealth.net
TCARE Inc.,"TCARE reduces long-term-care claims for Medicaid & Life/LTC insurance carriers by providing an evidence-based family caregiver support program thus delaying/preventing nursing home placement.  TCARE’s clients include State Government, Medicaid Payers and Life/LTC Carriers. In a two-year pilot, TCARE was proven to save $20M in Washington States Medicaid budget by delaying nursing home placement by an average of 21-months and reducing Medicaid LTSS claims by 20%. TCARE is the only evidence-based, Medicaid-approved and HHS-accredited family caregiver support program in the country. TCARE's unique outcomes have led TCARE to become legislatively mandated in Washington State. To-date TCARE has served over 100,000 family caregivers across 22 states. TCARE’s clients include BlueCross BlueShield of MN, Washington State Dept. of Health, Alaska Dept. of Health, Colorado Dept. of Health, Thrivent Financial and more.",https://www.tcare.ai
Infiuss Health,Infiuss Health democratizes remote access to patients and participants for your clinical research studies across Africa. We provide a direct-to-patient web-based technology platform that seamlessly recruits the right participants for your research study.,http://infiuss.com
Modicus Prime,"Modicus Prime's Self-Service AI software places cutting-edge AI where it belongs: in the hands of Life Sciences domain experts. The result is real-time AI processing of any image data - from biologic morphology analysis to commercial contamination detection - without data scientists.  Our computer vision solution, mpVision, provides intelligent image analysis to monitor biologics at any scale.  mpVision has been tested by scientists in a Top 10 Pharma company and supports our mission to eliminate contamination from the pharmaceutical industry.  These contaminations cost 100’s of million of dollars per incident as illustrated by the recent Covid vaccine 60 M incident experienced by J&J/AstraZeneca/Emergent.   Such unmet needs of the Life Sciences industry, including real-time product quality assurance, full agency compliance, faster go-to-market, and reduced operating costs, are being met with Modicus Prime’s Self-Service AI solutions.",https://www.modicusprime.com
Scan.com,Scan.com is a diagnostic imaging platform.,https://uk.scan.com
Intellihealth,"As a leading medical technology software and managed clinical services company, Intellihealth is dedicated to scaling and democratizing access to effective medical care for obesity. The company is responding to the urgent epidemic of obesity by providing a full-service health benefit for organizations that want to reduce healthcare costs for their businesses as well as their employees or members.

Intellihealth’s SaaS platform, Evolve, enables any health system to offer effective medical obesity treatment to new and existing patients, both via telehealth and in person. Evolve easily integrates with health systems’ existing technology to streamline all aspects of care, including assessment, diagnosis, prescription, and treatment.

Intellihealth’s clinical services affiliate providers at Flyte Medical specialize in partnering with health systems, employers and payers that need additional clinical resources to deliver virtual obesity medicine and weight management programs.",http://www.intellihealth.co
Perceiv AI,"Perceiv is an AI-based healthcare company specializing in the field of precision medicine. We are dedicated to help improving and saving patient lives through more efficient, accurate, subject targeting, and objective prognosis through advanced machine learning algorithms.

Diseases are more complex than they appear resulting in problems when finding the right population to treat and demonstrate treatment efficacy. We help pharmaceutical companies improve their chances of success by identifying the right subjects for their clinical trials using our AI-driven precision medicine platform. We specialize in the identification of subpopulations of interest in heterogeneous data and complex diseases.

Perceiv is currently developing applications in age-related diseases notably CNS/Alzheimer's disease and cardiovascular indications.",https://perceiv.ai
goPeer,"goPeer is a financial wellness company and Canada’s first regulated consumer peer-to-peer lender, connecting borrowers and investors through an online marketplace. goPeer replaces banks and traditional financial institutions to provide better rates to borrowers while creating a new investment opportunity available to all Canadians.",https://gopeer.ca
Railz,"Railz delivers a simple Accounting Data as a Service API to any lender, financial institution, accounting firm, auditor and tech developer that requires financial data on its small business customers. Our platform is integrated with the largest accounting systems in the world and automates a process that is otherwise very manual and labor intensive. Our API enables our clients to assess their Small Business customers' financial health by receiving accurate and immediate data from known sources for both existing customers and new applicants. 

Think of Railz as Plaid…for Accounting.",http://railz.ai
Skan AI,"Skan’s virtual process agents – a non-intrusive and lightweight probe on agent desktops or virtual machines - observes human work at scale capturing essential keystrokes and system interactions. Skan’s cognitive engine synthesizes the resulting images and stitches them into a process footprint, including all the process permutations and combinations. Skan’s evidence-based, data-driven approach enables enterprises to model, simulate, and monitor processes including automation and transformation. 

Skan’s cognitive engine has three components – a virtual process analyst, a gateway to process and synthesize image streams, and cloud-based machine intelligence models. Companies can define inclusion and exclusion lists of applications and websites. Skan’s selective data masking technique prevents recording sensitive data fields and inputs. Skan’s artificial intelligence technology does not require any expensive and time-consuming backend integration.",http://skan.ai
Spiro.ai,"Spiro is the first Proactive Relationship Management platform. Natively built on artificial intelligence, Spiro consolidates CRM capabilities, sales enablement and analytics into a single platform. By connecting to your email, calendar, phone and internal business systems, Spiro can:
-automatically create, update and manage your pipeline
-give proactive recommendations about how to close deals
-provide alerts on when to act based on real time triggers 
-Provide advanced analytics without the need for data entry 

Common use cases for Spiro are for mobile sales teams, customer success, increasing account health, or anyone looking to improve customer engagement and follow up.",http://www.spiro.ai
Flexiv,"Flexiv is building the world's first adaptive robots to automate complex tasks with ‘hand-eye’ coordination like a human in uncertain environments. Flexiv's adaptive robotic arm, Rizon, with force control and AI vision that can be widely used to automate tasks in industries like automobiles and electronics.",https://www.flexiv.com/en/
Esusu,Esusu is a venture backed fintech company that builds digital tools and services designed to help people improve their financial resiliency and establish robust financial identities. The company specializes in capturing consumer data related to rental payments and peer-to-peer payments.,https://esusurent.com/
Visby Medical,Visby Medical is a diagnostics company that develops PCR-based diagnostic tests for the detection of infectious diseases.,https://www.visbymedical.com/
Truebill,"Truebill is a payment platform for customers to manage their subscriptions and recurring bills (such as Netflix, Spotify, etc). Subscription services can also use Truebill to remove credit card fees and avoid the cost of charging expired credit cards.",https://www.rocketmoney.com/?rebrand=
Turing,"Turing’s intelligent talent cloud provides fast,on-demand hiring of remote software engineers vetted to a Silicon Valley standard for coding, communication, and performance. Turing can help scale engineering teams on-demand, and enable unprecedented scale, velocity, and accuracy for companies.",https://www.turing.com/
Cloudwalk,"CloudWalk is a digital payment acquirer. Their Next-Generation platform provides exceptional offerings at industry-lowest merchant fees, and has processed more than US$1 billion in transactions annually.",https://cloudwalk.io/
Quantenna Communications,Quantenna is a global leader and innovator of leading-edge performance Wi-Fi solutions focused on developing chipsets for high-speed wireless networks and devices.,http://www.quantenna.com/
Shippo,"Shippo is an American software company that helps e-commerce businesses, online marketplaces, and platforms integrate shipping with multiple carriers through their API and web application.",https://goshippo.com/
Bodyguard,"Expert in text moderation: our technology detects hateful content, online hate and cyberbullying on any platform.
The technology is available to individuals and families through a mobile app and to businesses through an API. 
Detection rate between 85% and 95% for only 2% error -- 5+ million comments analysed per month.

1) Individuals can use Bodyguard to protect themselves against toxic comments and messages on Twitter, YouTube, Instagram and Twitch. 50K users (influencers, journalists, policy-makers).

2) Families protect their children from cyberbullying: parents can get alerted straight away when their child is being cyberbullied. Deployed with Cardif Italy.

3) Businesses access the best text moderation solution in real-time on the market. 
Businesses can increase users’ retention and time spent on site, grow advertising revenue and protect their brand.",http://bodyguard.ai
Giraffe360,"Provider of virtual tour technology intended to transcend property capture and presentation. The company's virtual tour technology provides digital space capture for virtual tours, wide angle photography and precise floor plan that can be downloaded to supplement property portfolio, enabling the property industry to sell properties to their clients.",https://www.giraffe360.com/
OpenLegacy,"OpenLegacy is an all-in-one modernization platform makes core systems as light as the cloud. OpenLegacy improves the speed & success of digital transformation projects - resulting in 20x Faster Microservices/APIs Creation, 75% Lower Total Cost of Ownership, and 5x Better API Performance. OpenLegacy operates globally and across multiple industries. Among our clients are, Citi, AIG, MUFG, Liberty Mutual, FIS, ELO, Union Bank, Raiffeisen, Banorte, BNP Paribas, Cardif, CreditCorp, Prudential, Bancolombia, Piramal, ATG and Liberty Global.OpenLegacy enables organizations with legacy systems to release new digital services faster and more efficiently than ever before. It connects directly to even the most complex legacy systems, bypassing the need for extra layers of technology. Our product, OpenLegacy HUB is an all-in-one enterprise digital modernization platform, without disruption. With the OpenLegacy Hub, organizations can automatically generate digital services from any legacy source, deploy them to any cloud environment or framework, extend their functionality, add business logic, and manage these legacy assets in a reusable, discoverable, and easy-to-use way, all without any changes to the underlying legacy applications. 2022 New! OpenLegacy is available on AWS Marketplace.",http://openlegacy.com
Automation Hero,"Automation Hero’s Hero Platform_ is the only completely end-to-end intelligent automation platform on the market that brings humans, AI, OCR, workflows, connectivity and insights together in one platform.
We believe that in order to automate a business process completely, the solution must support all elements: it must keep humans in the loop, be able to process documents, run workflows, integrate IT systems or processes, and provide the appropriate insights. An end-to-end solution is not only more efficient at all of this but it also — most importantly — allows for significantly faster results and therefore democratizes automation in larger and smaller organizations.

A common misconception is that individual tech tools provide better results. Best-in-class software for handwriting translation must be better than software that combines translation with other functions. Right? But in a time where AI capabilities double every 3.5 months, legacy tools are showing their age even faster, and the distance between companies built on modern platforms vs. those with duct-taped legacy tools quickly increases.
Hero Platform_ is a modular platform composed of subcomponents that work together harmoniously but also, individually, achieve at-market or above-market performance.",http://automationhero.ai
Magna,"Magna is building a platform to turn DeFi investments into financial primitives. Our first product is Carta for Web3, where companies can manage their cap tables and distribute their token equity to employees, advisors, or investors. We're also building crypto-native tools for fund managers.",https://www.magna.so
RealSage,"RealSage builds technologies that organize and leverage data across the rental journey to generate AI-driven actionable insights and predictive reporting for enterprise rental owners and operators, helping them generate better returns on assets managed. Some prominent multifamily players are already using our technology to close their data decision gap across Canada and the US.",https://www.realsage.com/
GeDy TrAss,"We contribute to a quick and accurate design of gearbox and power transmission systems with particular attention to the early stage design in order to accelerate the time to market. In addition, we can provide results in dynamic framework that are not so common to achieve.

GearDraft is based on an algorithm that automatically generates a whole mechanical transmission by inserting a few input data in a short time. The algorithm chooses the components (bearings, shafts, synchronizers, gears), their dimensions and their positions to satisfy the user initial requirements. GearDraft is useful during the blank-sheet pre-design phase, when a new transmission has to be thought from the beginning, or even when a different layout of the components is needed.

The power of the tool is to leave to the user complete freedom on the choice of the algorithm constraints, for instance the overall dimensions of the gearbox and the transmission ratio. Afterwards, the output can be converted into a CAD/FEM interfaceable with other commercial softwares. GearDraft’s aim is to make the user save time, cutting down the preliminary design operations often made “by hand”, and reinvest it for further detailed analyses.",http://gedytrass.com
Galvani Power,"Born of a two-year development, Galvani Power provides modular, high quality and high-performance battery solutions for non-mass market electrification needs: $5.0B/yr demand not served by Gigafactories.

Galvani Power's differential competitive advantage: a complete and advanced battery platform that cuts dramatically customers' time to market and need of system integration. A lego-like set of ""bricks"" that can be composed into high-tech, plug-and-play batteries with all certification requirements needed to speed up homologation of final products in an industrial and scalable way.

Galvani Power's team combines young blood with experienced automotive professionals bringing in managerial and technical competence and industry network. Supply chain and customer development, under way for over a year, yielded a sizable portfolio of solid leads. 

CAPEX envisaged is about €2.8M fo the first three years - destined to technical equipment for prototyping and manufacturing. Founders together with Family&Friends investors to provide a first capital contribution in the range of €500K; advanced discussions are under way with Seed industrial investors for the remaining €2.0M needed for a full industrial scale-up leading to a targeted €10.0M+ turnover in 2025, with EBITDA of €2.0M.",http://www.galvanipower.com
Switch EV,"Switch is founded by Marc Mültin, the leading global authority on interoperability and ISO 15118. The company is backed by Link Ventures from Norway and a number of family offices and angels in California, Brazil, Slovenia and the UK. Based in London, Switch is now a team of 25 leading engineers and business developers, and will be launching its flagship charger management suite, Sara, in Q3 2022. Its operating system Josev enables the future of 2.0.1 charger capability, including plug-and-charge, V-2-G, V-2-X, predictive maintenance and true ""smart charging"". Our clients include leading charger manufacturers, mobility providers and OEMs.",https://www.switch-ev.com
Route Konnect,"Route Konnect's sensors and analytics tools offer intelligent, real-time insights into the movement within our cities – saving time, resources and our planet.

Route Konnect’s are developing an edge processing solution to process real-time sensor data to gain insights into movements within cities with the product “Road Konnect”. Such insights include: vehicle speeds, vehicle classification, vehicle counts, pedestrian counts and pedestrian movements heat maps. 

The company is currently exploring the use cases of such technology and deploy their software within a real world environment to test and validate system performance against defined use cases.

Their technology is at TRL7 as it has received funding from the Department for Transport (DfT) to develop innovations via the Transport Technology Research Innovation Grant (T-TRIG).",http://routekonnect.com
ThroughPut,"ThroughPut.ai is a Silicon Valley-based supply chain startup that puts industrial material flow on autopilot leveraging existing enterprise data. Being dubbed the ""Next Wave of Supply Chain Technology"" by FreightWaves, ThroughPut’s ELI software predicts demand, reorients production capacity, reassigns warehouse space, and reorders materials just-in-time, so businesses minimize overpromising & under-delivering. On a single ""super-connector"" software that sits on top of existing data architecture, ELI improves material flow and free cash flow, across the entire end-to-end value chain.",http://www.throughput.ai
UNLESS Collective,"Unless we change the fast fashion industry will continue to cover the world in plastic waste that never goes away. We're here to find a better way. We create statement product made from 100% plants, 0% plastic. All of our is built to last a lifetime, but is biodegradable when you're ready to return it to the elements.",https://unlesscollective.com
SwipeGuide - Capture,"Empower frontline excellence through crowdsourced digital standard work.

The SwipeGuide platform and apps empower leading manufacturers to reduce errors and downtime across sites, lines, and teams. Crowdsource scalable digital work instructions, procedures, and checklists and give your deskless workers the critical operational knowledge they need to excel in their tasks. 

Our customers - including Heineken, PepsiCo, Orkla, Barilla, and Coca-Cola - have experienced increases in First-Time-Right (up to +26%) while motivating their workforce with clearer standards that improve knowledge retention by 25%.

Digital standard work drives operational excellence and makes your workers awesome. 
SwipeGuide delivers it in a way that finally makes sense.

SwipeGuide is currently reducing errors in >200 plants and >500 teams at the lines in 93 countries.",http://swipeguide.com
Kahoona,"Kahoona, a 1st party data activation platform for the open-web, anticipates the tectonic change towards a cookie-less and identity-less digital ecosystem. Kahoona's solution helps digital businesses secure revenue and protect their users' privacy, in a walled-garden world. Kahoona's novel AI driven approach understands users by analyzing their interactions with websites and apps, transforms insights into audience segmentation data and actionable personalization to increase user monetization and improve conversion KPIs.",http://kahoona.io
