Company Name,Description,Link
Kruzr Technology Solutions,"Kruzr is world’s first technology-powered driving assistant designed to help drivers understand and mitigate the avoidable risks they face on the road. This preventive motor insurance technology helps insurance companies understand their risk exposure accurately, create personalized insurance policies, and help their customer be safer on roads, helping them improve their claims ratio. 

Kruzr's risk measurement is the most comprehensive driving safety index, which not just measures acceleration, braking, turns, and speeding, but also captures distractions and fatigue levels of the driver. However, we not only measure what the driver is doing but also capture what the real-time traffic and weather conditions the driver has to encounter. This makes Kruzr's safety index truly contextual and comprehensive, making it more meaningful and useful for underwriting and actuarial purposes. 

But the true innovation we've brought in is that we analyze the risk in real-time to identify the critical",http://www.kruzr.co
Cereverse,Description,https://cereverse.io
Omniscope,"Omniscope is a Deep Biotech whose technology decodes the immune system in High Definition to inform therapy and develop diagnostics through the convergence of immune cell sequencing, digital biomarkers, and artificial intelligence.",http://www.omniscope.ai
The CyberFish,"Playing cyber crisis simulation games, with an additional focus on soft skills, such as team cohesion, crisis communications, decision-making increase personal resiliency of team members. Building the muscle memory for collaboration decreases individual stress levels, improves team resilience, and has a positive impact on the effectiveness of strategies used, when having to face a real crisis together. We help you exercise your crisis team's collaboration via our platform's immersive cyber incident game simulations, specifically designed to reflect your industry cyber threat landscape. Our clients pick the scenario most relevant to their threat landscape, we get their teams crisis-ready. Our simulations are used by our clients to help them as part of a regular crisis exercising compliance routine, but we have also exercised large cyber security decision-makers as part of their team-building events, and helped critical national infrastructure providers work with their supply chain partners more effectively and think together in terms of cyber security vulnerabilities and build a joint response capacity. We offer facilitated and automated exercises, via our platform Resilience Dojo, which is the go-to resource to crisis management and business continuity teams in the UK and beyond.",https://www.thecyberfish.com
Prometheus Technologies,"Prometheus Technologies develops a plug-and-play investment platform enabling fintech partners to offer institutional-grade investing to their customers. It is AI-driven and delivers personalized ESG and Impact investing using machine learning techniques for alpha generation.

The company was founded in 2020 and is based in San Jose, California.",https://www.prometheusai.co
Skinive,"Deep Learning company desing and develop AI&CV-based skin health screening solution (API, Web & Mobile Apps) using smartphone cameras for home and professional use at the dermatologist level and without the need for expensive equipment.

Skinive 'solution supports:
- More accurate identification of skin conditions and risk assessment, leading to better health outcomes and reduced treatment cost
- Less onward referrals to secondary care, reducing strain on specialist clinics and lowering the costs of finding skin diseases.",https://www.skinive.com
NoID Solutions Ltd,"Private and secure encrypted email.

We protect email, what you write, what you read, what you attach, we encrypt email, files and more adding privacy, security and intelligence so you can do more with email than just email.

We build and supply server software to run your own Email server which encrypts email ""On send"" and decrypts ""On receipt"".

If you value privacy, data security and want to be free of monitoring, tracking, fraud and reputational risk then our products and services are for you.

Traditional email was designed in 1971 before privacy and security were considered. Today 300 billion emails are sent each day and multiple parties have access to those messages due to their plain text format.

We are a Privacy and Cybersecurity business headquartered in Malta Europe, operating wherever our customers and users are.

Today a growing, globally experienced team of 15 are developing and delivering solutions for the world we live in now and the future. The multi-national senior team have delivered multiple software and internet products and services since the late 90’s with over 100 man-years of application (Software/Web/App) development, Legal, Banking, Sales, Business Development, Operations, Support and Quality Assurance experience.",https://www.noid.ltd
RegTick,"Regtick is a visually intuitive software platform which simplifies the management of complex regulatory and compliance programmes so that organisations can reduce cost, improve control and collaboration and evidence compliance with regulations on an ongoing basis. Unlike existing platforms Regtick’s intuitive visual approach makes it easy to see actual progress in real time. Regtick is pushing the boundaries of visualisation software, creating our own technologies giving the user oversight of their end goal of compliance and the ability to zoom in on the specific detail of any given task.
Unlike existing platforms, Regtick’s intuitive, visual approach pushes the boundaries of visualisation software, creating new governance reporting systems. Giving the client not only clear oversight of their compliance needs and a fully audited history of interactions but also providing real-time transparency and simple clear workflow between teams. Regtick uniquely sits across risk, regulatory, compliance and governance silos.  Regtick leverages cutting edge UX design and visualisations embedding first-hand knowledge of how regulatory change programmes succeed and fail within the financial services-regulatory community. At Regtick “we take the complex out of compliance”.  www.regtick.com/video",https://www.regtick.com
Secure Elements Ltd,"Secure Elements presents an Integrated Product Cybersecurity Platform for MaaS companies to design cyber secure systems. The platform offers design, engineering and management capabilities to secure the product throughout it’s lifecycle, in compliance with ISO 21434 and UN ECE R155/R156.",https://www.secureelements.co.uk
PharmaTrace,"PharmaTrace is a blockchain based ecosystem where the pharmaceutical industry works together to do better business based on a common distributed ledger. It is secure, fast, efficient, trustful, agile, cross-interactive, cost-saving and easy to install. Our ecosystem is built on a decentralized network, utilizing the latest blockchain technology, thus providing high-level data security, complete traceability and simplified process pathways at both local and global levels.

Our bleeding edge platform leverages the blockchain, artificial intelligence, and machine learning, to protect supply chains, data exchange and integrity, in transaction channels, while also providing cost saving models and business operation upscale.

At PharmaTrace, we are the technical foundation to network the entire Healthcare Ecosystem for increased security and efficiency throughout the system.",https://www.pharmatrace.io/
Zeg.ai,"ZEG.ai is building next generation platform that will enable non-experts to build 3D assets for variety of use-cases including e-commerce, games, XR, brands, retail, and Human-Machine interface. We can create high-quality models of a wide range of furniture, shoes, clothing, and other consumer goods.",http://www.zeg.ai
ThroughPut,"ThroughPut.ai is a Silicon Valley-based supply chain startup that puts industrial material flow on autopilot leveraging existing enterprise data. Being dubbed the ""Next Wave of Supply Chain Technology"" by FreightWaves, ThroughPut’s ELI software predicts demand, reorients production capacity, reassigns warehouse space, and reorders materials just-in-time, so businesses minimize overpromising & under-delivering. On a single ""super-connector"" software that sits on top of existing data architecture, ELI improves material flow and free cash flow, across the entire end-to-end value chain.",http://www.throughput.ai
The Cool Corporation,"Cool is a CO2 utilization startup that begun at the University of Cambridge. They believe CO2 represents a source of carbon that can be used to make valuable materials. By making advanced carbon materials from CO2 they aim to close the carbon cycle, permanently.  

Their unique technology is permanently carbon negative, profitable and scalable. Their end product is an advanced forms of carbon that has applications in construction, aerospace, defence, and more. By installing on-site CO2 refinery, they can decarbonise industrial point source plants. The end products are sold to industry, ofsetting the carbon capture cost and making emissions reductions profitable.",http://thecoolcorporation.co.uk
Strayos,"Strayos is a platform that uses 3D visual AI technology to create digital twins of mining and cement sites. The platform gathers data from a variety of sources, including drones, satellites, scanners, smart drills, and sensors. Strayos provides AI-powered tools for every step of the mining value chain, enabling companies to extract raw minerals and materials more sustainably.

By applying a combination of visual sensing technology and AI software, Strayos is able to improve the detection of high-grade ore, model geology more accurately, and optimize extraction methods to increase yield and reduce waste. The platform has been implemented in 600 mines and integrated with the top 2 drilling OEMs. Customers of Strayos have reported up to a 10% reduction in energy costs for ore crushing and milling processes, which translates to 100K CO2e for medium-sized mines.",http://strayos.com
Electrified Thermal Solutions,"Burning fossil fuels to generate heat and electricity on-demand produces an enormous amount of carbon emissions. Wind and solar are cleaner but intermittent and can only deliver electricity, not the 1700-2000°C needed for intense industrial processes and to run efficient compressed-gas turbines.

A technology that converts intermittent electricity into constant high heat could transform the energy industry. Known options to store renewable electricity thermally—such as hydrogen, hot rocks, carbon blocks, or molten salts—are capital-intensive, not very efficient, or both. There is an urgent need for highly efficient, cost-effective options to produce carbon-free heat for steel and cement production and on-demand electricity for the grid.

Electrified Thermal Solutions is developing an energy storage technology that stores renewable electricity as 2000°C heat. Based on novel, low-cost conductive ceramics, this easily deliverable, zero-carbon heat is the most efficient and cost-effective option to replace fossil fuels in industrial plants and turbine power plants.

ETS’s technology, the Joule Hive, can store gigawatt-hours of excess renewable energy as 2000°C heat more efficiently and cheaply than competitive thermal storage technologies.",http://electrifiedthermal.com
O.C.O Technology,"O.C.O Technology has developed a Carbon Capture and Utilization technology that gives value to waste streams like bottom ashes, sewage boiler ashes and other combustion waste, and turns it into manufactured aggregates (Manufactured-LimeStone, or M-LS) while capturing CO2 in the process.

The technology, called Accelerated Carbonation Technology or ACT, uses carbon dioxide gas and requires very little energy inputs — but rather relies on the high reactivity of the waste material.",https://www.oco.co.uk
ecoLocked,"ecoLocked is dedicated to achieving a gigaton of CO2 impact using the power of biocarbon. We provide a set of biocarbon-enhanced, CO2-reduced ""ecoLocked materials"" to help decarbonize heavy industries. Our products substitute CO2-intensive materials like cement while also providing negative emissions from the conversion of organic waste into biocarbon—thus locking away carbon for thousands of years. In addition, ecoLocked materials are lighter, water-absorbant, and provide superior qualities in sound and thermal insulation.
Beyond building materials, our biocarbon has great properties for soil improvement, flood protection, animal feed, water filtration, and diverse industrial applications",http://ecolocked.com
Concrete4Change,"Using our technology concrete, pre-cast and cement manufacturers, contractors and developers can meet the 2030 and 2050 net-zero targets.

Net-Zero Target
Using our technology concrete, pre-cast and cement manufacturers, contractors and developers can meet the 2030 and 2050 net-zero targets.

Market Advantage
Our cost effective, innovative, environmentally-friendly technology will enable you to win new business in stringently regulated, sustainability driven, construction applications.

Economic Edge
Reducing the cost of concrete through direct cement reduction using the natural properties of CO2 sequestration.",http://concrete4change.com
Next2Sun,"Next2Sun has developed an agrivoltaics system whose core innovation lies in the vertical installation of special solar modules that can exploit the solar radiation from both sides (“bifacial” modules).

The two sides of the module are deployed facing East and West respectively. As a result, electricity is produced, especially in the morning or evening. The areas between the module rows can continue to be used for agriculture and emerging flowering strips offer space especially for the endangered insect world and many bird species. Variable row spaces of at least 8 meters continue to enable a wide range of agricultural destinations.",https://www.next2sun.de
Guaranteed,"In an industrial environment large equipment is often tailor-made and exposed to severe operational conditions requiring a high structural integrity and lifetime.  This results in long lead times when metal parts break down or even complete replacement of entire installations when parts have become obsolete, moulds have been lost or suppliers have gone bankrupt. This either leads to huge financial losses due to unforeseen lengthy production standstills or to high storage and logistic costs.  Guaranteed offers a solution to these problems. 

Guaranteed's technology allows to repair and rebuild on demand these large slow movers, reducing the long lead times and eliminating the need for large amounts of new raw materials as well as avoiding storage or transportation costs. Born from Innovation, we use state of the art unique simulation, monitoring and inspection tools to guarantee first time right zero-defect production; while being raised in Industry Guaranteed provides a one-stop-shop for industrial reliability.",http://www.guaranteed.be
Enco - Energia Collettiva,"Enco is a start-up with a clear mission: to give people back control over their own energy, 100% renewable of course. Enco is a fundamental step towards a zero-emission economy, more people-centred than profit-centred.

How? By creating energy communities in a simple and transparent way, equipping citizens with the tools they need to produce energy on the roof of their homes, and share it with their neighbours, without having to deal with bureaucracy. Enco's vision is a world in which everyone benefits from the economic, environmental and social advantages of an energy community, and is empowered to produce energy.

Specifically? Enco installs photovoltaic panels and storage systems, creates and manages energy communities, and distributes the proceeds fairly among the participants. With Enco you can produce renewable energy, consume it, share it with your neighbours, save on your energy bills and contribute to a greener Italy.",https://energiacollettiva.com
Tactotek,"TactoTek creates injection-molded structural electronics that integrate flexible printed circuitry and discrete electronic components into mass-produced 3D injection-molded plastics. With its patented and patent pending technology, TactoTek enables differentiating and cost-effective designs with highly scalable production processes. Because TactoTek encapsulates electronics and circuitry in injection-molded plastics, the resulting products are inherently durable and protected from the environment.",http://tactotek.com
Sustained,"Sustained helps costumers make more sustainable choices starting with more environmentally friendly food, using their Chrome and Safari browser extensions users can get environmental impact information about the food products they are browsing when shopping.

Their mobile app is the costumers' companion while shopping in store or assessing the pantry, ready to give environmental information for products costumers scan.

Sustained currently calculates the product ratings using production and logistical averages based on the ingredients in the product. This is an estimate rating calculated using data from 'LCA background modelling' information and frameworks.",https://www.sustained.com
NextInput,"Nextinput is the market leader in MEMs based force-sensing solutions for touch enabled devices in markets such as consumer, wearable, IoT, automotive, industrial, medical and many other applications. It is our mission to bring 3D touch solutions to market and enable the next generation of intuitive user interface (UI)",http://www.nextinput.com
Parloa,"Parola is a developer of a dialog management system intended for building automated dialogues with the help of Artificial Intelligence. The company offers a dialog layer that allows enterprises to unify their conversational AI strategy in a single hub and helps brands to manage their conversational AI experiences across all of their customer channels, enabling clients to have better conversations with their customers.

Their aim is to build the most comprehensive solution in this sector for enabling every company in the world to have better conversations with their customers. The startup pursues this vision with the highest standards of technical engineering and combines it with innovative leadership and a strong commitment of every team member to re-imagine the future of customer communication.",http://parloa.com
Nourished,"Nourished 3D-prints personalised supplements containing seven different types of vitamins, minerals and/or superfood ingredients. Each stack is printed fresh and shipped to the customer on a monthly basis. Alternatively to personalised stacks customers can purchase pre-made stacks. 

Nourished formulations use a base made up of erythritol, pectin and maltitol to create a pleasing sweet taste without any sugar and the negative impacts sugar can bring.

All our packaging is recyclable and home compostable, and 98% of our ingredients are sourced from the UK.",http://www.get-nourished.com
Net Zero,"NetZero is a carbon-removal venture targeting corporates serious about moving towards net-zero emissions. We extract carbon (“biochar”) from agricultural waste in tropical developing countries, and convert it into sustainable soil amendment and green energy. 

When mixed with soil, biochar remains stable for at least hundreds of years, hence providing the only permanent carbon removal model currently scalable. The emission-offset effects of our products generate high-quality carbon credits.

Biochar-specific methodologies for accounting carbon credits appeared in 2020; Verra/VCS (“Verified Carbon Standard”), the world’s leading certification body for carbon credits, will have its own methodology by autumn 2021.",http://netzero.green
Holifya,"Holifya is an innovative healthtech startup, one of the first in Italy to offer such a personalised service rooted in science.  Holifya's mission is to create the first hub, the first platform for Digital Health & Wellness, with a personalised and scientific approach, based on users' genetic profile, biomarkers, habits and goals. To leverage technology, and advanced data analysis modalities (such as machine learning), to support doctors or nutritionists in creating an increasingly personalised 360° health and wellness plan that evolves with the clients needs.  Holifya analyses all aspects of health and wellness - through DNA testing in conjunction with costumers' relevant biomarkers and goals - from the body, to the mind.",https://www.holifya.com
HIRO Robotics,"HIRO Robotics was founded to unlock access to the latest frontier of robotics. HIRO's team of robotics engineers partners with clients to develop a deep understanding of the specific process and then develops and deploys ad-hoc systems.

HIRO Robotics' systems are applicable in industrial settings as flexible co-bots, as well as advanced systems to support in Electronics Waste (WEEE) disassembly and recycling.",https://www.hirorobotics.com
Enuan,"Enuan is an AI Conversational Partner with +10y experience selected by Enterprises to digitalize Customer Service & Support
Virtual Agent (Chatbot/Voicebot) used by Enterprises as TIM Brasil(#1 Telco in South America), ENEL (#4 Utility Company in EU), TNT (#6 Logistic Enterprise in EU)  to improve CX and reduce customer service costs for all contact channels (Live Chat, WhatsApp, Messenger, Google Assistant, Amazon Alexa, Telegram, Apple Business Chat, IVR..)",https://www.enuan.com
Covariant.ai,"Covariant is building the Covariant Brain: universal AI that allows robots to see, reason and act on the world around them. Founded in 2017 by the world’s top AI researchers and roboticists from UC Berkeley and OpenAI, Covariant is bringing the latest artificial intelligence research breakthroughs to the biggest industry opportunities.",http://covariant.ai
Copprint,"Copprint's Nano Copper Ink is a self-sintering alternative for high conductivity, low cost printed electronics. Their Nano Copper Ink is compatible with standard printing technologies, featuring rapid 2 second sintering by standard heating methods, and 50% bulk conductivity, with substantial cost reduction compared to silver ink. Copprint's Nano Ink offers an affordable, conductive ink for a range of applications including: RFIDs printed on paper, touch panel bezel contacts, printed antennas, printed PCBs, heaters & defoggers, fabrics, 3D printing of conductive patterns, batteries and many other printed electronics applications.",https://copprint.com
Black Swan Data,"Black Swan is a pioneer in using proprietary AI techniques to transform raw social data into refined datasets that generate remarkably accurate insights into consumer trends — so called Social Prediction. Using Social Prediction, Black Swan Data is able to predict consumer behaviour and trends more accurately and further ahead than anyone else. This is how Black Swan empowers leading CPG companies, like PepsiCo, Unilever, Danone, and others, to make the right decisions and to get to market faster, with greater confidence.",http://blackswan.com
Actronika,"Based on more than 30 years of research by our co-founder, Vincent Hayward, Actronika has developed haptic technologies that enable tactile feedback to be seamlessly integrated in human-machine interfaces. Actronika's technologies can be integrated in a plethora of devices. Unitouch is Actronika's interactive haptic ecosystem tailored for the integration of realistic vibro-tactile haptics in next-generation hardware and software products.",http://actronika.com
Arch Systems,"Arch works with top tier global manufacturers to extract data from machines, both legacy and new, and drive uniform metrics for enhanced productivity and predictive analytics. Arch focus on the discrete manufacturing supply chains around electronics in auto, medical devices, and enterprise and consumer goods.

A core part of Arch's mission is to also make the building blocks of IIoT and Industry 4.0 technology available for sustainable development. Arch started by monitoring wells in Tanzania Africa and coming up with cutting edge technology to make dumb machines into smart machines. Arch powers various projects monitoring wells for access to clean drinking water, UN Sustainable Development Goal 6, and projects promoting sustainable industrialization for all nations, goal 9.

Named Forbes 30 under 30, StartX, Skydeck, and Village Capital Founder, BASES Champion / Top Stanford startup in 2016.",https://archsys.io
Senzoro,"Senzoro combines ultrasound with artificial intelligence to disrupt predictive maintenance for clients across various industries (i.e. utility companies (hydro power plants); power stations (motors and pumps); automotive industry (spindles, power station); etc.). The data acquisition is done with a mobile measuring device, artificial intelligence then derives the health status (no installation or fixed sensors is required). 

Ultrasound can detect failures much earlier than vibration technology. Advances in electronics and sensor technology have led Senzoro to acquiring big-resolution ultrasonic (raw) data. The data was trained on 5000+ different sources (pumps, motors, spindles, turbines, etc.). Senzoro is focussed on the monitoring of rolling bearings (ie. 1 measurement is sufficient), but also develop solutions for centrifugal pumps, gears and plain bearings (ie. up to 3 measurements are needed).",http://senzoro.com
