Company Name,Description,Link
Octane11,"Octane11 is a B2B-focused data analytics and collaboration platform that connects paid, owned, and earned marketing, sales, and product usage data to drive real business results. We help B2B enterprises with $100M+ in revenue to integrate, enrich, and analyze data across teams, and compare performance to industry benchmarks. Octane11 is backed by Javelin Venture Partners, BDMI, Honeystone Ventures, Plug and Play Ventures, Circadian Ventures, Base Ventures, and AperiamVentures. Launched in late 2020, Octane11 is already helping some of the largest B2B enterprises break down data silos and turn every digital interaction into an actionable insight. Follow us on LinkedIn at: https://www.linkedin.com/company/octane11.",http://octane11.com
Lucky Labs,"Lucky's platform enables omni-channel brands to engage with people at the right time and location to generate foot traffic to their physical stores. Our location-based Lucky Moments API collects consumer insights and audience profiles to personalize rewards that is given to a user to push them to visit a physical store. By integrating into location-driven apps and brands' own web and mobile e-commerce touchpoints, we deliver user engagement leading to customers showing up to the brand's location. Audience data, decisions, and preferences are easy to analyze by brands for further optimization.",http://luckylabs.io
EAIGLE,"We are a human-centric AI and ML company developing enterprise computer vision solutions for the workplace and public spaces. Our solutions enable customers to optimize processes, reduce costs and grow revenues.

We work with global enterprises in a wide range of sectors including retail, supply chain, logistics and commercial real estate.  Our technology enables our customers to identify inefficiencies in their operations or breaches in their policies all in real-time notifications or alerts.  

What's Unique About Us:  
1-Our technology is hardware agnostic; this means we can work with existing cameras and sensors reducing our customers’ capital investment when deploying our solutions enterprise wide.  
2-Our technology processes inputs from optical cameras, infra-red and radar sensors.
3-Our technology has superior accuracy which eliminates false positives and interruptions to operations

Access Control Solution
To ensure only the right people get into your facility, we developed a robust check-in and check-out software housed in a heavy-duty kiosk. The system automates the registration process for employees, visitors, contractors, and packages. For added security, the system comes with the capability tointegrate with your access control system to unlock doors.",http://www.eaigle.ai
Plunk,"Plunk’s advanced analytics revolutionize the way homeowners, home experts, and investors value and invest in residential real estate—through the power of AI, machine learning, and image analysis. Plunk tracks an individual home’s price in real time and represents a new level of both comprehensiveness and transparency. Plunk’s real-time solutions are accessed by consumers, real estate professionals, and the investment community via a suite of data and software products, across both web and mobile platforms.

Plunk was co-founded by Brian Lent and David Bluhm, two tech startup veterans who have played integral roles at some of the world's most innovative companies.​

With their combined experience, our founders are building a new evolution of housing analytics. And with a world-class team of data scientists and engineers, they are bringing next-generation Artificial Intelligence and machine learning algorithms to the residential real estate industry.​",https://www.getplunk.com
XP Health,"XP Health is a health tech startup introducing a new kind of vision benefit for employees leveraging machine learning.

Founded in 2019 by Antonio Moraes and James Wong, XP Health is an AI-powered vision benefits platform for employees and their families to get frames from the world’s leading designers like Tom Ford, Ray-Ban, Armani, Gucci, Coach. Its proprietary deep learning model uses facial recognition technology that recommends the best frames based on facial dimensions with 98% accuracy. The company is working with companies like Chegg, Zenefits, and Sequoia Consulting Group.",http://xphealth.co
Hammurabi,"Hammurabi is targeting the most intractable problem within the health insurance industry: how to predict major medical events and price stop loss insurance using minimal data inputs.  Our technology is powered by novel machine learning algorithms, coupled with a vast proprietary database.  We improve loss ratios for carriers and close ratios for brokers -- all while providing value for employers.",https://www.askhammurabi.com
Verbal,"Many organizations struggle to improve customer engagement and satisfaction due to long onboarding periods to reach proficiency coupled with high turnover of customer-facing front-line staff. These inefficiencies hamper organizations from building teams of highly proficient experts and cause companies to lose $450k/yr in wasted costs for a team of 100 front-line staff members according to a recent study.

Enter Verbal. The Verbal voice intelligence assistant analyzes live calls and draws on organizational protocols to provide real-time coaching, automates QA, and streamlines admin tasks. Verbal supports non-licensed staff handling scheduling and customer service to licensed clinicians handling care management and drug safety. 

Verbal shortens the time to onboarding proficiency by providing real-time coaching during customer interactions to minimize rote memorization and lecture style training. Meanwhile, managers can skip manual QA and instead take on more direct reports or get more time for training and hiring.",https://www.tryverbal.com
Lazarus,"Lazarus Forms is a data extraction API that makes cluttered, unstructured PDFs as usable as any JSON. Our form extractor pulls entities, tables, and key value pairs from your documents, out of the box with no need for example forms or training. Our AI recognizes both handwritten and typed text, extracting more data and requiring even less human intervention. We streamline your data intake and transfer processes associated with various types of documents; claims forms, new patient intake, attending physician statements, adjuster reports, lab results, ACORDs, and anything that can be fit in a PDF.",http://lazarusai.com
Prevedere,"Prevedere’s predictive AI leverages global data, econometric modeling and machine learning algorithms to create a critical new layer of planning insight to the enterprise to forecast future performance of metrics such as demand, supply, cost and price up to 5 years into the future.

Macroeconomic and industry volatility are increasingly impacting business planning and strategy in many ways. According to Harvard Business Review, 85% of a company's performance is dependent on external factors. However, most organizations forecast and plan leveraging primarily internal data, missing the key drivers of their business. They may also lack the ability to include their unique leading external drivers into the forecasting process in an automated and repeatable manner.

Prevedere's platform is a comprehensive toolkit for systematically forecasting and proactively monitoring lines-of-businesses, by geography, product, category, customer, channel, or end-use industry.",http://prevedere.com
Togggle,"At Togggle, we believe in a human-centric approach to personal data: our goal is to ensure that users are the only entitled holders of their data and retain full power to control and manage them.
To turn our vision into reality, we rely on the PIMs (Privileged Identity Management) concept: 
Users’ data are automatically stored in their personal POD, a secure and decentralized data storage. 
As a result, users can now decide consciously which services and third parties can access their data and for what purposes. 
Togggle’s PIMs require users to verify themselves once as all the credentials and information provided are ready to be reused as often as desired without going into the KYC process repeatedly.
From a company perspective, through our service is possible to efficiently decentralize KYC and considerably reduce storage and security costs, representing considerable expenses in the user authentication process.
This means **instant onboarding** for the people already verified into other platforms: in one click, all information is verified.
Companies will have access to even more data from an inter-operable perspective: decentralization will cut costs while offering a better-customized service thanks to comprehensive and consistent user data.",http://togggle.io
Lamar Health,"Lamar Health provides a software to clinical geneticists to save time while improving patient care.
We help with patient onboarding, AI-powered clinical notes and connecting patients to clinical trials.

Rare disease treatment has a lot of trial and error due to small numbers of patients. Through it's software Lamar Health is building a centralized database of genetic-treatment-outcome information that is valuable to life science companies, physicians and patients.
 
We contribute to efforts in improving diagnostics and therapeutics using the data we collect.
 
Our founding team is stacked with Stanford alumni with PhDs in Genetics, founders with profitable startups and a family member of a rare disease patient.",https://lamarhealth.com
Ciba Health,"Ciba Health is a personalized digital therapeutics and virtual care platform. We utilize a precision health approach to treat and reverse chronic conditions while optimizing the physical and mental well-being of our patients. We are focused on researching the unique biochemistry of every patient, get to the rootcause of symptoms, reduce medications, prevent and reverse diseases, and let people live life to its fullest. Ciba Health utilizes a multidisciplinary root-cause approach grounded in holistic and precision medicine. We take a comprehensive and personalized approach to care for each patient — studying their medical history, lifestyle, and unique biochemistry. We are using cutting-edge technology and a dedicated team of providers to equip patients with the knowledge they need to reverse chronic conditions and lead healthy lives. Each patient has a dedicated health coach, dietitian and physician who work as a team",http://cibahealth.com
Vespia,"Vespia is an AI-powered business verification (KYB) solution that is the standard of trust. Our tool is used by fast-scaling businesses from sectors such as FinTech, crypto, sharing economy, and eCommerce in order to comply with Anti-Money Laundering (AML) regulations, and to verify and onboard their business counterparties.

Vespia combines everything needed for onboarding business customers/ partners/ investors/ suppliers in one place. With Vespia, you can verify data from 300 business registers, perform AML checks (PEP, Sanctions, Adverse media), ID verification, find UBOs, Court cases, check Proof of Address, and Monitoring, all in a seamless and user-friendly process.

Vespia’s verification process allows companies to search for any business information with minimal data input and to easily request any additional information needed from the inspected entity.",http://vespia.io
Fast Charge Engineering,FCE customize the powertrain and the Energy Storage systems with the customer requirements. The best work is done on liquid cooled Energy Storage Systems: Increase the performance of these systems without damage the cells. This innovation has a patent request.,http://fceitalia.it
Vizen Analytics,"Vizen’s demand planning solution aids automotive parts manufacturers and food & beverage companies improve their supply chain performance by pro-actively predicting raw material lead times, labor utilization and product demand. The Empowered-AI™ platform connects forecasting results to business KPIs by applying the right external data modeling to counterbalance dynamic market conditions including Covid, socioeconomic & political impact patterns that affect SKU shortages and future buying behavior.

*Increase Forecasting Accuracy by > 15%
*Improve Margins & EBIDTA 
*Prevent Plant Shutdowns
*Reduce Food Waste",http://vizenanalytics.com
RECARBON,"Management of waste from carbon fibres is becoming a significant societal issue.
For decades, the most popular disposal methods were landfilling and incineration; significant economic losses were incurred from not recovered fibres. These methods have led to increasing environmental awareness to recycle carbon fibres into a valuable resource and prevent the cumulating wastes.
Currently the focus is on manufacturing wastes (prepreg offcuts, obsolete moulds, faulty parts, etc). However, given the ever increasing utilization of carbon fibres in various industry applications, end of Life wastes are expected to exceed manufacturing wastes by 500%.
RECARBON offers ready to use intermediate materials and has developed a functional approach for manufacturing products from rCFs in the form of Organosheets and Prepregs.
Prepregs, cores and organo-sheets targets are high-performance applications in the aircrafts, sport & leisure, industrial and automotive sectors.",http://recarbon.it
Racing Teams app,"As startup being established, it is the first and only professional platform dedicated to all team members involved in Motorsport world: relevant features are now all in one! 

Main topics (cross platform): 

1. Vehicle data management 
 - Sessions planning and tracking,
 - Automatic mileage update,
 - Continuous driver connection;

2. Team and Personal logistics
 - Synchronized acceptance calendar,
 - Customized inventory,
 - Job offers and shop;

3. Championship interface
 - Track procedures automation,
 - Database system,
 - Forums section.",http://racingteamsapp.com
INVENTIO.ai,"INVENTIO.ai: Artificial Intelligence for Industry Made Simple (https://www.inventio.ai)

Our solution is software: industrial apps integrate cutting-edge AI (machine/deep learning) and modern Web UI/UX technologies and designs. Our apps run completely at the edge, and we are strongly involved in hardware, since we are working hard to be completely hardware agnostic in our proposals. They can also run in hybrid and cloud environments.

We solve industries and manufacturing shop floor challenges at the edge, such as inspection, grasping proposition, anomaly detection and others. We provide “industrial-app” as products, focused on specific scenarios and custom solutions tailored on the customer’s business needs. We build our AI core on the latest research outcomes.",http://inventio.ai
HMDrive,"HMDrive has developed the first effective software solution enabling the usage of AR glasses on vehicles. HMDrive technology is general purpose one: no matter the vehicle or the driving context. Thanks to HMDrive, AR glasses can be used for creating transparant AR dashboards in the driver's field of view (improved safety) but also for projecting holograms in the outside environment.

The AR ADAS based on HMDrive technology can reduce the risk of accidents on heavy-duty industrial vehicles by 80% and improve productivity by 20%. On the other hand, HMDrive solution can also be used in the field of sports cars as the enabling technology for ""Metaverse motorsport competitions"" where real drivers on real cars compete on-track against AR vehicles.",https://www.hmdrive.it
Invisens,"A family of 4D radars for automotive L2/3 and L4/5 applications. They are based on off-the-shelf parts and novel low-level software processing. It is not an imaging radar, but along with cameras covers almost any scenario. We also think of open radar processing libraries and datasets later on.

Problem solved: 
Automotive radars are black boxes developed by a limited amount of suppliers. It happens because, unlike cameras, radars implement either complex high- and low-level processing on the unit due to legacy constraints. Dependency on the limited amount of radar suppliers also disadvantages those who develop sensor fusion systems.

Solution: 
Eliminate bottlenecks in the radar architecture caused by conventional high-level processing. It is now split between a sensor fusion system a new low-level engine on the radar. It has consistent data processing rules that fit a sensor fusion system. The approach shows its best on custom radars but works for radar-on-chip as well.

Vision: 
A company that develops radars based on its IP and promotes the automotive radars idea in general. To make money we want to strategically partner with automotive suppliers/manufacturers.",http://invisens.com
2electron,"2electron is an engineering company.

Core mission: providing Innovation and high-tech engineering services, E-Mobility device/system development, turn-key projects for the automotive sector.

The automotive User Experience in the future in term of FUN TO DRIVE. In ICE vehicles, the sound, the vibrations and the gear-shifting, are the soul of driving.
EVs are characterized by a direct/single speed transmission and complete lack of engine noise and vibrations, which results in a much plainer and less appealing driving.

Patented McFly technology, has been invented to provide real-time driving interactions (we change the performance) and enabling a wide range of UX (such as sounds, vibrations, driving sensations, dynamics of a real gear-shifting, i.e.). Offer new and branded UX will be one of the most important challenges in the Future of Sustainable Mobility.",http://2electron.com
Novac,"Novac supercaps are completely solid, thanks to the usage of innovative materials and procedures. The absence of liquid prevents explosions, leakages or evaporations which usually limit the number of possible applications of supercaps. The high safety and the wide temperature range are their most important competitive advantages.

Problem solved: At the moment the integration of supercapacitors into vehicles leads to different problems, all deriving from the presence of a liquid in their structure. They have a standard and bulky shape (this brings to constraints on the application fields), are unsafe, and work in a very limited range of temperatures. 
Solution: 
Novac solves these problems by developing a new generation of supercaps completely solid, using innovative materials and procedures. Furthermore, this supercap is completely mouldable. Thanks to this feature, it is possible to adapt it to different surfaces, reducing the encumbrance and easing the design of the vehicle.

Vision: The vision of Novac is to revolutionize electric mobility coupling batteries or fuel cells with safe and high power density systems, perfectly integrated to satisfy structural functions, increasing the life and performance of the battery pack.",http://novacsupercap.com
Ohoskin,"Ohoskin is a vegan and sustainable leather-like material made with the byproducts of oranges and cacti. With their production capacity and bio-based composition, they can grant vegan leather with high quality, making Ohoskin suitable for luxury brands.

Problem solved: Around 80% of leather worldwide is tanned using chrome, a highly toxic process the  impact workers‚ health and the environment. Brand and consumers of luxury goods feel torn between keeping enjoying what they love and living a more sustainable lifestyle.

Solution: The company patented a bio-based material that they can process and tan as leather with no environmental and social costs.

Vision: They want to make Ohoskin a brand that adds value to luxury goods and makes the company that produces them a symbol of a new luxury that is sustainable and fair to everyone.",http://ohoskin.com
Green Independence,"Green Independence is a startup committed in developing disruptive energy technology solutions, gradually leading the transition to a sustainable zero-emission world powered by renewables.

Its core business is the strategic and synergic use of different renewable sources in order to provide an innovative energy production and storage system with a very low enviromental impact.

Green Independence’s main technology is the NewArtificialLeaf (NAL). NAL makes possible the transformation of combustion’s waste products, CO2 and water (sea water, river water, waste water), into renewable and profitable resources. NAL is a stand-alone-device, inspired by nature, that recycles CO2 emissions while solving the solar energy storage problem by producing ""solar fuels"". NAL is a new breakthrough technology that is able to efficiently store solar energy into chemical bonds, similarly to what happens in natural photosynthesis, converting water into Green-Hydrogen and/or recycling CO2 into Syngas.",http://greenindependence.eu
Carchain,"With Carchain, current and future owners can build a chain of trust around a car using data relating to its history, integrity, and life, all embedded in an NFT that its owner can share, sell, and transfer.
Our ecosystem of blockchain solutions provides transparency for buyers and sellers when advertising, trading, and investing in classic, modern and collector cars.
In addition to the classic & collector car market, all types of the 1.4 billion cars on our roads along with motorbikes, planes, and other vehicles, can be digitised and preserved via our platform.",http://thecarchain.com
Newtwen,"Our mission is to democratize the use of digital twins throughout the industry.

We develop software that generates real-time embedded digital twin solutions for model predictive control and diagnostics of electromechanical systems, enhancing performance, longevity, and reliability.

In essence, our toolchain creates a precise digital replica of a physical device, such as an electric motor or power module, in order to accurately model the electromagnetic and thermodynamic behavior of the system across a wide range of operating conditions.

We then apply our proprietary mathematical approach to exponentially reduce the computational complexity of this model—so much so, in fact, that our digital twin can be integrated into the device itself to compute in real-time, “on-chip,” as part of an amazingly fast and accurate firmware solution.

By accurately predicting temperatures and other critical system parameters thousands of times per second, our Digital Twin On-Chip solutions not only provide unprecedented insight for real-time control techniques to enhance system performance, but also pave the way for data-as-a-service capabilities such as predictive maintenance, monitoring of component aging, and anomaly detection.",https://newtwen.com
Reefilla,"Reefilla offers its service through some enablers:
-Platform: Consinst of an IT system that is connected to the hardware via API to monitor the fleet and predict the needs via AI
-Portable Chargers: Swappable batteries enabled simple and quick charge
-Stationary Charger: DCFC is up to 8x Faster than AC and includes an easy set-up and relocation, Especially second life batteries are used for their service

Reefilla wants to increase the charge opportunities in urban areas, with easily accessible services when needed or where infrastructure is yet to come through. They offer an integrated ecosystem-based battery powered portable device that is  connected and optimized by an IoT Platform.",http://reefilla.com
ZYTLYN Technologies,"ZYTLYN is a data analytics and AI company, helping customers address their most urgent problems and opportunities with granular, qualified, and actionable data, predictions and insights. Its platform gives customers the ability to optimize critical decision making through predictive insights.",http://zytlyn.com
Carbon Reform,"Carbon Reform is a Delaware-based company focused on modular carbon capture for indoor air. Ventilation is an enormous financial burden on commercial building owners and operators, especially as organizations like the CDC encourage buildings to be over-ventilated to maintain good indoor air quality. 

State of the art variable air ventilation systems track building occupancy, correlating with CO2 and pathogen buildup, and increase ventilation during the peak hours of the day when electricity prices are highest. 

At Carbon Reform, we have created a smart appliance which will capture CO2, with drop-in filters for other harmful pollutants like VOCs, human bioeffluents, and viruses, and allow building owners to decrease their ventilation rates and save energy. The device captures and sequesters the CO2, allowing our customers to take advantage of carbon credits and work towards their sustainability goals.",http://carbonreform.com
NODE Robotics,"Today, manufacturing in high-wage countries is challenged by multiple trends:
Decreasing batch sizes, demand volatility, cost pressure, lack of specialists and social distancing.
Therefore, the factory of the future must be highly flexible and autonomous.
NODE provides plug & play software solutions, which enable operation of collaborative multi-vendor AMR fleets and reduce TCO for intralogistics by up to 65%.",http://node-robotics.com
Simplifyber,"Simplifyber is changing the way clothes are created, transforming the world's $1.5 trillion Apparel Industry and 250-year old factory system into sustainable, additive manufacturing. By assembling clothes with chemistry rather than with sewing machines, the Simplifyber process eliminates much of the waste, carbon emissions, and water pollution that have led to fashion’s devastating environmental and social impact in recent years. Efficient, plant-based and closed-loop, Simplifyber is revolutionizing the way the world manufactures clothing with its proprietary technology and cutting-edge techniques.",http://simplifyber.com
