Company Name,Description,Link
CIPIO.ai,"CIPIO.ai, the Community Commerce Company, helps Brands grow exponentially by identifying, authenticating, and activating Brand enthusiasts. CIPIO.ai’s Community Commerce solutions enable brands to dramatically and cost-effectively increase sales, customer retention, and Brand engagement. CIPIO’s award-winning Community Commerce solutions serve leading brands such as World’s Gym, Dapper Boi, Crunch Fitness, Biovanta, Everybody Eat, CryptoCharged, Dlish, FitnessSF, Moehair, and many more.",https://www.cipio.ai
Tomi.ai,"Tomi.ai helps modern marketing and sales teams drive profitable growth with plug&play predictive analytics.

It is most helpful for ""long-cycle"" businesses (like real estate, banking, SaaS, and EdTech) that suffer from not being able to optimize their marketing programs directly for revenue and LTV.

We use Machine Learning to connect hyper-granular (""Ultra HD"") behavioral signals (way beyond what's available in Google or Adobe analytics) with future CRM outcomes like sales qualified opportunities and closed won revenue. 

As a result, we turn first-party intent signals into rocket fuel for profitable growth by:
- helping our customers align their marketing investments with marketing touchpoints and assets with highest incremental revenue contribution and true ROI;
- turbo-charing feedback loops with ad platforms smart bidding/programmatic bidding engines to train them to drive revenue & LTV rather than leads, free trials, or content downloads,
- upgrading accuracy of lead and prospect scores, enabling sales teams to improve win-rates and increase sales productivity.

In short, Tomi.ai makes it possible for traditional businesses with long and largely offline sales cycles to run efficient digital marketing campaigns that were previously only available to e-commerce.",https://tomi.ai
Neosapience,"Neosapience develops Typecast.ai, a virtual voice and video actor casting service.  They're a synthetic voice and video platform, Typecast, that allows users to turn text into video without having to record and edit it in a studio. Neosapience makes AI-powered virtual actors accessible to everyone.

They have  developed core technology to synthesize hyper-realistic and emotional speech from given text script. Currently, they run an AI voice actor service called Typecast based on the technology. Furthermore, they are also developing technologies to generate facial expressions and gestures, so that anyone can cast AI powered virtual voice and video actors and generate videos by just editing text. It would lead to a revolution in the media entertainment industry as creating content can be cheaper and easier.

Neosapience is a startup founded by former Qualcomm engineers and KAIST graduates in 2017. It's an artificial being enabled by artificial intelligence, will soon be everywhere in our daily lives.",https://www.neosapience.com
Pareto,"We are revolutionizing the RPA market through Tess - the 1st professional AI assistant in the world. Our mission is to rehumanize people and robotize processes, through a powerful AI-enhanced automation software, freeing the human mind to do what it does best: be creative, strategic and brilliant. Our vision is to accelerate human success through a powerful AI-enhanced end-to-end automation platform.
With a no-code DIAA (data integration, analytics and automation) platform we help mid-market and enterprise companies to scale their marketing and sales operation.
Main solutions: Pareto ETL and Data Warehouse; Omnichannel Budget Manager; Paid Media and CRM Integration; Antifraud for Display Ads; A.I. Anomaly Detector; and Smart Triggers with 2nd Generation RPA Algorithm.
More than 500 active customers, $500M+ under management per year and 25,000 companies connected to our software.
We are an award winning technology, recognized by Google since 2017 as one of the most innovative partners in the world.",http://www.pareto.io
Adriel,"Adriel is the Ad Operations (AdOps) platform of choice for leading brands and agencies around the world. 

We help businesses make effective decisions faster without manually collecting, processing, and managing data. To date, we’ve assisted over 6,000 enterprises automate data aggregation, mitigate marketing campaign risks, and discover insights.

Adriel provides intuitive dashboards designed to help marketers identify profitable campaigns, channels, and ad creatives. The platform empowers you to make optimal decisions based on standardized cross-channel data, storytelling visualizations, and real-time performance alerts.

Companies like Harley Davidson, H&M, LG, Samsung SDS, and many more trust us to scale their digital marketing initiatives.",https://www.adriel.com
Wink,"Wink is industry’s first multi-factor biometric authentication platform that combines the convenience and security of face-id type experience enhanced by strong digital voice printing and very strong device biometrics. Our unique and patented one-way anonymous encryption technology ensures full privacy protection as the unique Wink ID represents the user’s device, face and voice data as a 3D model of numbers and characters that cannot be decrypted. Unparalleled Security, Guaranteed.Wink gives internet applications an unparalleled multi-factor authentication capability that eliminates passwords so they can deliver the ultimate omni-channel experience to their consumers with a unique combination of speed, convenience and security.

Any app developer can integrate Wink Login authentication plug-in to eliminate account take-over, account sharing and other password related problems to enhance security, improve customer experience and say goodbye to reset password or forgotten password issues.

Merchants and E-Commerce companies can integrate the Wink video checkout plug-in to eliminate account takeovers. Dramatically improve conversions and eliminate cart abandonments as consumers simply smile to check-out. Make long checkout forms and forgotten passwords a thing of the past.",https://www.wink.cloud
Kahoona,"Kahoona, a 1st party data activation platform for the open-web, anticipates the tectonic change towards a cookie-less and identity-less digital ecosystem. Kahoona's solution helps digital businesses secure revenue and protect their users' privacy, in a walled-garden world. Kahoona's novel AI driven approach understands users by analyzing their interactions with websites and apps, transforms insights into audience segmentation data and actionable personalization to increase user monetization and improve conversion KPIs.",http://kahoona.io
Influur,"Professional marketplace where brands and influencers can meet and work, with operations in the US and Latin America. Addresses the creator market economy, connecting multiplatform stars, digital celebrities, and influencers with brands. The platform simplifies all aspects of the traditional influencer marketing process – from prospecting, and negotiating to payment – in one place.

How does it work? Brands post a job opportunity, Influencers apply, Brands do a casting and pay through the app.

In less than a year, Influur is being used in 9 countries and brands activating campaigns on Influur include Universal Music, Warner Music, Sony Music, Viacom, Paramount Plus, Boxy Charm, Subway, and Hard Rock Cafe, among others. 

Influencers working on Influur include Sofia Vergara, Thalia, Jen Selter, Gianluca Vacchi, Danna Paola, Juanpa Zurita, Calle y Polle, Pautips, Juca, Camilo, Evaluna Montaner, Xime Ponch, Sebas, among others. 

Our greatest customer value proposition is the optimization of budgets. On average, Influur optimizes 15%-30% of the brand's budget. This happens because Influencers are applying for job opportunities and they are choosing the jobs they want to do. Most of the time, Influencers end up charging less when they apply for job opportunities.",https://www.influur.com
Rella,"Gone are the days of trying to stay on top of your brand deals within your email inbox. Consolidate your deadlines, links, and earnings all in one place with the sponsorship feature. Rella is here to keep you organized so you can focus on creating connections with brands.

With Net 30/60/90, getting paid as an influencer is a challenge in itself. Get paid on time, predict your expected monthly income, send automated invoices, and store all your brand payments in one place with the earnings feature. Rella is determined to help you be in control of your income.

Most creators have more than one Instagram, TikTok, or YouTube profile. Manage your social profiles all under one account. Rella is here to keep your personal, business, and client content separate and organized.

Your dream of having a consistent posting presence is now a reality! Schedule posts for any social platform from a day, week, month, or list view. Batch and auto-post with Rella’s content calendar. In order to encompass every aspect of your business, Rella is inclusive of all types of content, including non-social media platforms like podcasts, blogs, and newsletters.",https://getrella.com
Stakeholder Labs,"Stakeholder Labs is building products at the intersection of community, ownership, and brands. The acceleration of the average consumer's financial literacy and overall market participation has created a unique opportunity for companies to engage with their customers as owners. The ownership economy hinges on this idea that customers who are also owners are better customers. 

Stakeholder Labs recently launched Roundtable - a platform for public brands to create ownership benefits programs (i.e. stockholders). The software integrates with a brand's existing loyalty and/or commerce experiences (web + mobile). The backend tracks marketing metrics across the entire customer journey - ROAS, CLTV, engagement, CAC, etc.",http://stakeholderlabs.com
SwayBrand,"SwayBrand's AI-powered platform creates authentic influencer micro-marketing moments. Their platform is built by actual influencers. Their mission is to become the go to platform for influencers to create content and for brands to discover and activate this authentic, creative content to audiences that want to reach.",https://www.swaybrand.com
Octane11,"Octane11 is a B2B-focused data analytics and collaboration platform that connects paid, owned, and earned marketing, sales, and product usage data to drive real business results. We help B2B enterprises with $100M+ in revenue to integrate, enrich, and analyze data across teams, and compare performance to industry benchmarks. Octane11 is backed by Javelin Venture Partners, BDMI, Honeystone Ventures, Plug and Play Ventures, Circadian Ventures, Base Ventures, and AperiamVentures. Launched in late 2020, Octane11 is already helping some of the largest B2B enterprises break down data silos and turn every digital interaction into an actionable insight. Follow us on LinkedIn at: https://www.linkedin.com/company/octane11.",http://octane11.com
Yofi,"In 2021, 35% of Online Black Friday Shoppers were bots and fake accounts. Many of these bad actors (bots, arbitrageurs, fraudsters, etc.) are undetected and have rapidly expanded from tickets and limited-release items into anything that can be flipped for a profit. Individuals have multiple identities; whether unintentional or malicious, it skews critical data for operating the business - forecasting inventory, determining the success of marketing campaigns, increasing customer lifetime value, and more. Digital identity is essential for a successful brand.

We have experienced the expensive and wrong decisions from using skewed data at some of the largest retailers in the world (e.g., Nike, Apple, Gucci, etc.), and we do not want others to go through the same struggle. We created Yofi because digital identity and customer operations are essential for all brands, and the tools being used were expensive and ineffective.

Yofi is a platform that enables you to better understand your customers, their intentions, and the best way to interact with them. We solve this for brands by providing granular customer and product-level recommendations based on your genuine customers' intentions and desires. Stop guessing and start knowing with Yofi!",http://www.yofi.ai
Lucky Labs,"Lucky's platform enables omni-channel brands to engage with people at the right time and location to generate foot traffic to their physical stores. Our location-based Lucky Moments API collects consumer insights and audience profiles to personalize rewards that is given to a user to push them to visit a physical store. By integrating into location-driven apps and brands' own web and mobile e-commerce touchpoints, we deliver user engagement leading to customers showing up to the brand's location. Audience data, decisions, and preferences are easy to analyze by brands for further optimization.",http://luckylabs.io
Ownit,"Ownit is a seed-stage startup based in Palo Alto, CA that raised $8M last year from Caffeinated Capital, SciFi VC (Max Levchin’s fund), GGV Capital, and industry angels. The team consists of ex-Amazon, Walmart, and Meta alums with combined decades of eCommerce and ad-tech experience. Additionally, the CEO and CTO's previous company was acquired by Amazon. 

(1) Key Problem: While brands and creators run hundreds of personalized marketing campaigns to improve conversion, they all drive to the same dot-com experience negating the entire personalization effort.

(2) Ownit Solution: Ownit's technology allows brands to quickly and efficiently build personalized landing pages optimized to convert, to match each marketing campaign. Ownit's checkout experience allows brands access to first-party, multichannel transactional, and behavioral data as brands and their partners better understand how consumers shop across all their channels. 

(3) See live pages -- https://www.ownit.co/checkout/showcase/w4Ncvr6c",http://ownit.co
Syrup Tech,"🌍 In a world with deep supply chain disruptions, true omni-channel networks, and sustainability-minded consumers, there is a need for next-generation inventory systems.

🍯 That’s why we’ve built Syrup, an AI-powered predictive software for inventory decisions in commerce. By leveraging more data in real-time, we empower merchandising and planning teams with allocation, ordering, and planning recommendations.

🚀 Our eventual hope is for commerce to no longer be a wasteful industry, as our intelligent platform empowers inventory excellence at every step in the value chain.

👔 We're VC-backed by Google's AI fund (Gradient Ventures), as well as former executives from Adidas, Zalando, ASOS, Reebok, Bonobos, Salesforce, ThredUp, and Stripe. We're working with fast-growing brands such as Faherty, Reformation, and Desigual. 

Concretely: For omni-channel brands and retailers who use Excel or legacy software to manage their inventory, Syrup Tech provides predictive software powered by AI to empower better and more sustainable inventory decisions.

Our software is being used by fast-growing brands (incl. Reformation, Faherty, Desigual) who are seeing dramatic reductions in manual work (-90%), significant P&L results (+6.8% full-price sell-thru, -75% stock-outs).",http://syrup.tech
XGen AI,"XGen Ai is a comprehensive machine learning framework for eCommerce that includes a multi-model framework, independently trained models per customer, automated model turning and performance enhancements, real-time predictions (5-7 times per second), and individualized recommendations using multiple hyper-sophisticated neural nets.

Beyond the machine learning that forms the core of the XGen Ai solution, it is also a comprehensive, full-stack analytics and personalization solution that allows eCommerce teams of any size to deploy everything – starting with the fully custom model through to XGen Ai CX Cloud to render dynamic user experiences directly on site.

By providing the pinnacle of machine learning technology in a fully automated and configurable environment unique to each brand, XGen Ai enables eCommerce teams to maximize the value of their data and build a truly unique customer experience for every visitor.",http://xgen.ai
Wafi,"Wafi provides a simple API and drop in UI that makes it easy to send and receive instant bank payments. Built on the RTP network, Wafi enables ecommerce businesses to accept payments via bank accounts instead of credit/debit cards and save on payment processing fees.",https://www.wafi.cash
Brij,"Brij is a platform for brands to create & manage QR Code-activated digital experiences for their products, allowing customers to register, reorder, and more with a scan. Brands can build ROI-optimized landing pages using Brij's no-code builder, manage the dynamic experiences in Brij's platform, track analytics to understand how this new channel is performing, and sync customer data collected with their e-commerce platform and CRM.",http://brij.it
Retail Aware,"Retail Aware helps brands, retailers, and their partners track in-store product and shopper behavior data in real time. We help you know what shoppers want like never before to increase your ROI. For the first time, an accurate and precise way to track shopper behavior around your products in-store. We were founded with the mission to bring in-store shopper behavior data to brands, retailers, and their partners in real time. Our patent-pending and award-winning BiaaS data solution is helping clients understand what shoppers want like never before to drive ROI.",https://www.retailaware.com
Enzymity,"We are developing a method for breaking down polymers such as plastics and resins into monomers with the help of synthetic enzymes. The enzymes are tailored for specific types of material (e.g. PET or synthetic rubber) and are produced by genetically modified microorganisms. The monomers which result from the process can be used to create new virgin polymers, thus reducing the need for fossil fuel derived plastics/resins. The cycle can be repeated many times and does not deteriorate the quality of the material, as opposed to the currently prevalent mechanical recycling. 

We are using nature-inspired active proteins (enzymes) engineered for efficiency and scale – a somewhat similar principle to how animal stomachs work to digest complex organics. Our business model is process licensing to plastics value chain players (producers, recyclers, precursor producers), prototype process release planned for H1 2022.",http://enzymity.com
SINBIOSYS,"The company develops and produces luminescent tracers, nanomaterials and intelligent materials, studies their formulations and designs optical instrumentation for use in the industrial sector. The company is currently validating an oxygen sensing system for modified atmosphere packaging. SINBIOSYS also aims to commercialize a new silicon-based material (Si), which is part of a family of luminescent semiconductor nano materials known as 'quantum dots' (QDs). In recent years SINBIOSYS has developed a portfolio of synthetic routes to obtain SiQDs that can be used in a wide range of applications, a plan for industrial scale up for both SiQDs and for the non-destructive oxygen tracking system for the food industry. SiQDs also offer the possibility of sorting plastic waste with a biocompatible and cheap material, obtaining purity of the recycled polymer higher than 99%.

Knowledge in the field of molecular sensors and optical and spectroscopic instrumentation also allows us to provide materials, consultancy and ad hoc solutions also in other industrial fields.

At the moment the company is collaborating with the first potential customers who are testing its products, if the results are positive it will be necessary to scale the production processes.",http://sinbiosys.com
Enlipsium,"An innovative materials company with a portfolio of products for Manufacturing, Medical and Building industries.

Enlipsium's core strength is in thin-film materials and coating materials, we have our own Research and Development capabilities as well as scale up synthesis capabilities for various solution processed materials. 

One of our flagship product includes - Enlit SG100 Anti-Dust Coating Technology. This is a water-based sustainable coating solution that can be applied on a variety of surfaces, such as building facades and front glass of Solar Panels. With this coating in place, users can reduce their maintenance cycles since dust accumulation gets reduced drastically. In areas of high rainfall, the super-hydrophillic surface allows dirt and dust to be rinsed off effective keeping the surface clean for a long time. We see a minimal reduction of 50% in water usage to maintain the same area cleanliness and a 20% long term cost savings for facility management. 

Enlipsium is also working on few other innovative solutions for various technology. Such as thin film dosimetry and coming out with the world's first perovskite-based scintillators. There is also strong interest in using our materials in the field of anti-counterfeiting.",http://enlipsium.com
Super Polymer,"We transform polymers into super polymers. 
Our technology generates new and improved polymer properties that will impact many industries such as coating, paint, displays, optics, electronics, micro and nano electronics, sensors, medical, cables and many more.

Some important properties are:
•	Particle size - we can produce particles in a controllable diameter in the range of 3-40 microns. It can be reduced to a sub-micron size. 
•	High refractive index - SP-HDPE has a refractive index of 1.96 comparing to raw HDPE that has a refractive index of 1.52. Effective scattering observed in a wide spectral range of 400-2000 nm [VIS to NIR].
•	Opacity – the particles are white and opaque.
•	High dielectric constant - Calculated dielectric constant is 3.85.
•	Suspension in liquids - Stable dispersion in liquids (water, oil, organic media), no surfactants required, no media optimization (i.e., pH) required.  
•	Super Hydrophobicity - Coatings that contain SP’s particles have a contact angle of 155° or higher, and a sliding angle of 2°.
•	Dry particles repulsion - Free dry particles would not adhere or attached to a surface containing SP’s particles.
•	Unique structure - The special morphology of SP's polymer’s carries many merits.",http://super-polymer.com
CelluComp Limited,"CelluComp is a Scottish-based material science company that produces microfibrilated cellulose from the waste streams of root vegetables, namely from sugar beet. CelluComp produces a product called Curran®, which is shipped in powder form and adds mechanical and thickening properties to a wide range of other materials, such as paints, concrete, cosmetics, home-care products, paper and even composites.",http://www.cellucomp.com
Teratonics,"See through the matter...
This is the solution proposed by Teratonics to the industry to reduce its poor-quality costs and to optimise its processes.
Teratonics markets an innovative non-destructive imaging solution based on ultrafast terahertz (THz) pulses to reveal the invisible inside many non-conductive materials (e.g. plastics, composites…). 
This breakthrough technology can perform 3D dimensional control (typically thickness measurements with micrometric precision) and detect defects such as voids, dimples, density variations...
The key differentiators of Teratonics's technology are its single-shot detection (10 million times faster than the state of the art) and its high level of automation (part scan, image generation and defect detection).  
This solution is safe for operators, contactless and rapid.
It can address several markets such as automotive, aerospace, naval, renewable energy, medical devices…",http://teratonics.com
Biotic,"Biotic provides an end to end, fully bio-based, fully biodegradable polymers manufacturing process. We use macroalgae and our secret recipe to create PHBV polymers.Enabling optimal transition from fossil-fuel-plastics, with a scalable, fully biological, environmentally friendly process, eliminating recycling needs, contributing towards reducing greenhouse gases emission, with a zero waste and circular economy approach.Biotic is an Israeli based startup, which envisions a world where plastic pollution is not a concern and in which the consumer purchases and uses the product in the exact same manner, and after use, tosses it to any trash and the product fully biodegrades no matter to the environment.",http://biotic-labs.com
Montinutra,"Montinutra develops and produces ingredients for the cosmetics, food, and beverage, and chemical industries using forest industry side streams as its raw material. Our products can be used as a functionals for film forming, emulsions or a as a biopolymer for  bioplastics. Further, they also have active properties as for anti-oxidants, prebiotics, anti-inflammation, soothing and skin conditioning. We are in a Seed+ phase, progressing with market development towards the Series-A financing and establishing a Commercial Plant. Currently we run a TRL7 pilot production. The proprietary production technology is proven, all natural, good yield, scalable and CAPEX affordable. Through our industrial partner, Metsä Group, we have secured our raw material supply, and the raw material is globally abundant. The technology is not limited to current raw material, saw dust, but also other biomaterials can be leveraged. Looking forward new partners to develop and commercialize new products!

Montinutra produces Sprucegum™ from sawdust, which is commercially relevant, underutilized Forest industry side stream. Sprucegum™ is an adjustable emulsifier & stabilizer, and could be a potent component in future health beneficial functional foods.",http://montinutra.com
