Company Name,Description,Link
Patch Technologies,Patch is an API-first platform for carbon removal that enables businesses to achieve their carbon neutrality goals by offsetting emissions created by their business operations.,http://patch.io/
DataTron,"Datatron provides a single model governance (management) platform for all of your ML, AI, and Data Science models in production.",http://datatron.io
Lorica Cybersecurity,Lorica Cybersecurity provides secure and privacy-preserving data analytics solutions leveraging breakthrough fully homomorphic encryption (FHE) technology.,http://loricacyber.com
RapidFort,Automatic Attack Surface Minimization,https://www.rapidfort.com
Gabbi,Gabbi reduces the rate of delayed diagnosis for women by empowering them to proactively seek the care they need.,https://www.begabbi.com
Stere.io,"""GrubHub"" for insurance programs. Stere is a digital ecosystem for businesses to find capacity and access digital tools to launch, improve and grow insurance programs",http://stere.io
OTONOMI,"OTONOMI is a blockchain-powered parametric MGA that transforms cargo insurance policies into fast, cost-effective, and transparent digital products",http://otonomi.ai
Federato,"Federato's Risk Ops solution uses a collaborative, real-time approach to coordinate risk selection and proactively safeguard P&C carriers and MGA's portfolios.",https://www.federato.ai
Axitech Group,"Intelligent orchestration of collision and claims management in the connected vehicle ecosystem, driven by the needs of the customer.",http://www.axitech.co
So-Sure,The future of home contents and phone insurance has arrived (and it's up to 80% cheaper when you connect with friends & don't claim).,http://www.so-sure.com
Zelros,Zelros turns data into unique customer experiences,http://zelros.com
Allganize,Allganize helps business automate answering questions with Natural Language Understanding technology.,https://allganize.ai
Hypatos,"Hypatos deep learning technology automates complex document based back office processes like accounting, travel & expense management, loan underwriting or claims handling. We provide end-to-end document automation: We classify, capture data points from, perform validations on & enrich documents",https://hypatos.ai
betterdata,Turn data liabilities into assets with structured synthetic data,http://betterdata.ai
BreezoMeter,"BreezoMeter provides real time and hyper-local air quality, wildfire and health-focused environmental insights for consumers and businesses.",http://breezometer.com
iLife Technologies,Spend less time selling life insurance and more time making money.,https://www.ilife.tech
Hyfe,AI that runs on any phone and detects and analyzes cough,https://www.hyfe.ai
BodesWell,BodesWell partners with financial services companies to provide digital financial planning to millions of clients.,http://bodeswell.io
CareSignal,"CareSignal is provide real-time, actionable data to support proactive outreach to your at-risk patients.",https://www.caresignal.health/
KironTech,Kirontech uses cutting edge machine learning technology and deep industry expertise to tackle fraud waste and abuse in medical claims.,http://kirontech.com
LifeScore Labs,LifeScore Labs is an insurtech company delivers data-driven risk-scoring model.,https://www.lifescorelabs.com/
Voxel,"Keep your workers safe, while reducing worker’s comp costs",https://www.voxelsafety.com
Gigaforce,"Provider of a SaaS-based, claims platform expediting subrogation, recovery, & salvage processing for insurance.",https://www.gigaforce.io/
FutureProof,FutureProof’s makes climate risk actionable for financial professionals,http://futureprooftech.io
Quantexa,Quantexa is a data and analytics software company pioneering Contextual Decision Intelligence that empowers organizations to make trusted operational decisions by making data meaningful.,http://quantexa.com
Rasa,Rasa is building the standard infrastructure layer for conversational AI,https://rasa.com/
Duality,"Developer of a digital data collaboration software designed to protect privacy, internet protocol and regulation compliance",http://dualitytech.com
ManagingLife,"Helping patients and healthcare professionals better measure, monitor, and manage chronic pain.",https://managinglife.com
Amplify Life,"Finally, life insurance that makes sense. Protect your family, fill healthcare gaps, save for retirement in one plan.",http://beamplify.com
Helgen Technologies,We empower industries that utilize heavy machinery to reach new productivity levels.,http://helgen.tech/
Streem.ai,Streem.ai is an AI assistant enabling manufacturers to identify blind spots and patterns in data using automatic machine learning model selection & optimization.,https://www.streem.ai/
The Button Corporation,"The Button Corporation (bt.tn) is the creator of the bttn, the simplest Internet user interface in the world.",https://www.bt.tn/
ExLattice,ExLattice develops intelligent engineering software for digital manufacturing wit real-time feedback.,https://exlattice.com/
Breezo,"At Breezo, they provide probiotic air treatment for your space. Their products create a bio-balanced environment to sleep, work, live in.",https://www.breezo.eu/
Hypertype,Personalize your email replies continuously at hyperspeed.,https://www.hypertype.co/
Mona,Mona provides the most intelligent and flexible monitoring platform for AI and ML teams.,http://monalabs.io/
gnista.io,Keep control of your sensors.,https://www.gnista.io/
Staex,Scale your IoT business with next-generation deployment tool for modern machine infrastructures.,http://staex.io/
SymetryML,"High speed, automated machine learning for data in motion.",http://symetryml.net/
Visionaries 777,Visionaries 777 delivers pioneering interactive software solutions to solve global business needs that combine engineering expertise with the latest 3D real time technologies.,http://www.visionaries777.com/
Taubyte,"The simplest path for developers to build, run and scale edge-native applications",https://taubyte.com/
75F,IoT-Powered Smart Building Solutions Delivering Comfort and Energy Efficiency.,https://www.75f.io/
Makini,Makini is the universal industrial maintenance data API.,https://www.makini.io/
Sensemore,Sensemore helps companies to quantify and track their machines' health.,https://sensemore.io/
Ruuvi Innovations Ltd.,"Everything you need to measure the world. Their simple, high-quality and certified open-source products work out of the box consumers and businesses can easily adapt them to their own solutions.",https://www.ruuvi.com/
i-flow,"For manufacturers that struggle to leverage factory data and tap the potential of analytics and AI in their factory operations, i-flow provides a data control room to make operational data actionable in no time and without a single line of code.",https://www.i-flow.io/
Stream Analyze,"Stream Analyze makes any device smart. Simpler, quicker and interactive. The company specializes in software for scalable real-time analyses of data in motion.",https://www.streamanalyze.com/
Restado,Restado the leading platform allowing the reuse of construction materials from leftovers and demolitions by applying the principles of circular economy and urban mining.,http://www.restado.de/
Dayta AI,Dayta is a software company which develops retail analytics SaaS solutions for brick-and-mortar retailers.,https://www.dayta.ai/
TBMDesigns,"TBM Designs through its InVert self-shading window system reduces solar heat gain in buildings, resulting in reduction of up to 25% of air conditioning costs while significantly reducing greenhouse gas emissions.",https://www.tbm-designs.com/
Carbon Upcycling Technologies,Carbon Upcycling Technologies uses the waste of today to build a better tomorrow by converting CO2 gas into solid products. CUT sells advanced solid products derived from greenhouse emissions and cheaply available solids.,http://carbonupcycling.com/
LIGHTYX,LightYX leverages new technologies from the autonomous vehicles in order to communicate the blueprints to the workers in a revolutionary way.,https://www.lightyx.com/
ISAAC,"Company that offers devices and services for the diagnosis, monitoring and earthquakes protection of existing buildings.",https://isaacantisismica.com/
Beawre Digital SL,Beawre provides solutions for continuous operational risk management.,http://www.beawre.com/
FLX Solutions,FLX Solutions has patented and developed intelligent inspection/maintenance robots that are miniaturized to operate in spaces that humans can't easily access.,https://www.flxsolutions.com/
Dynamic Infrastructure,Dynamic Infrastructure disrupt civil infrastructure operation and maintenance.,http://diglobal.tech/
Cybrik,Cybrik project intelligence is a cloud based AI platform for radically improving engineering and construction projects.,https://www.cybrik.ai/
Climate X,"Climate X projects how climate change will damage properties, assets or infrastructure under different climate scenarios, quantifying how that damage impacts valuations and costs of moving to a green economy. Quantifying financial impacts of climate change, turning future losses into opportunities.",https://www.climate-x.com/
SwissAI,Swiss AI modelling technology to make your risk management future ready with AI.,https://www.swissai.com/
Globechain,"Globechain is an B2B ESG reuse marketplace offering external and internal reuse and loaning, generating ESG data on the impact.",https://www.globechain.com/
Oxygen at Work,Oxygen at Work helps companies reduce health care and energy costs by using data analytics and specific plants to improve office indoor air quality.,https://www.oxygenatwork.org/accueil.html?lang=fr
TakeAir,BioTech Indoor Air Management,http://takeair.world/
ioAirFlow,Data intelligence platform for commercial buildings,http://ioairflow.com/
Zadar Labs,Zadar Labs brings radar intelligence to autonomous systems,https://www.zadarlabs.com/
UNL,"UNL is a smart location platform that provides businesses with the mapping, location and data tools to build highly scalable, hyper-local services and applications.",https://www.unl.global/
SuperAnnotate AI,"The end-to-end platform to annotate, train and automate your computer vision pipeline.",http://www.superannotate.ai/
Aiden,"Developer of an automotive software intended to provide rich, reliable and real-time communication across vehicle brands.",http://aidenabled.com/
Annotell,The analytics and annotation platform used to ensure the performance of autonomous vehicle perception systems.,https://www.annotell.com/
livil,livil makes it possible to work safely and productively in the vehicle.,https://www.livil.co/
Axion,Axion is the future of program management for engineering leaders in R&D.,http://axionray.com/
Radchat,"Radchat offers a completely new approach to vehicle communications. By adding communication capabilities to radar chips we can proactively delete radar interference, enhance radar functionalities, and open up new possibilities within data sharing.",http://radchat.tech/
Sibros,"Sibros provides an embedded firmware and cloud platform for performing advanced Over-the-Air (OTA) software updates and data logging enabling vehicle OEMs to deliver new connected services, reduce costly software recalls and leverage the power of live vehicle data.",https://www.sibros.tech/
Synop,Building the Backbone of Commercial EVs,http://synop.ai/
Infinite Mobility,Solar Electric Vehicles for Urban Mobility.,http://www.infinite-m.com/
"Aura Intelligent Systems, Inc.",A disruptive 4D millimeter wave sensor for autonomous mobility,http://www.auraisystems.com/
General Radar,Developer of high resolution 3D imaging radar for autonomous systems.,http://www.genrad.io/
Kontrol,The co-pilot for autonomous systems.,http://www.kontrol.tech/
Merlin Mobility,Merlin is an autonomous technology company with a mission to enable safe driving for all.,https://www.drivemerlin.com/
Nodar,We build mass-producible 3D sensors.,http://www.nodarsensor.com/
Zing Robotics,Zing is creating the autonomous mobile workforce of the future,http://zingrobotics.com/
DriveU,Open connectivity and teleoperations platform for autonomous vehicles.,https://www.driveu.auto/
Bareways,Bareways develops software solutions to enable driving assistance features in non-urban areas with non-paved roads.,http://bareways.com/
Fixposition,Fixposition develops products that provide ultra-reliable high-precision navigation.,https://www.fixposition.com/
Terra Autonomy,Stealth mode startup focused on increasing the safety and reliability of autonomous vehicles,https://terraautonomy.com/
Glint Solar,Accelerating the solar revolution by utilizing satellite data and machine learning.,http://www.glintsolar.co/
SoHHytec,"SoHHytec provides renewable systems that allow for the onsite production of solar fuel and power which is cleaner, greener, and more cost-effective.",https://www.sohhytec.com/
Encoord,Encoord is a software company specialized in the modeling of energy networks.,https://www.encoord.com/
Bloom Biorenewables,Producing petroleum alternatives from plants.,http://www.bloombiorenewables.com/
Versogen,Producing green hydrogen at scale—reliably and affordably.,http://versogen.com/
Carbmee,"Analyze, automate, and decarbonize your enterprise with Environmental Intelligence.",https://www.carbmee.com/
1s1 Energy,1s1 Energy is developing breakthrough proton exchange membrane (PEM) technology to enable an economically viable production of green hydrogen via water electrolysis and improve the efficiency of using hydrogen to generate energy via fuel cells.,https://www.1s1energy.com/
BeePlanet,BeePlanet Factory develops technological projects based on the reuse of batteries removed from the electric car.,https://www.beeplanetfactory.com/
Phelas,"Phelas develops and distributes the missing key for the energy transition: a containerized, competitive and sustainable energy storage system for renewable energy operators, grid operators and energy industries.",http://www.phelas.com/
Everimpact,Helping cities and companies finance their CO2 reduction efforts.,https://www.everimpact.com/
Plexigrid,"Plexigrid is changing the way energy ecosystems by allowing the electrical systems to work as a perfectly tuned orchestra. An ecosystem made of  electricity grid operators as well as energy retailers, aggregators and energy communities, where consumption adapts to the production, allowing more renewable generation.",http://plexigrid.com/
Guaranteed,"Guaranteed repairs and rebuilds large metal parts for mining, oil & gas, railway, maritime, energy, and other heavy industries beyond conventional techniques using Wire and Arc Additive Manufacturing (WAAM), prolonging the life of industrial equipment, reducing lead times, logistic costs, and waste.",http://www.guaranteed.be/
Gridcognition,Optimizing the planning and operations of distributed energy systems.,https://www.gridcognition.com/
Kauel Technologies,We are experts in asset and productivity monitoring with artificial intelligence using computer vision and data processing in energy sector related industries such as oil and gas and electricity.,http://www.kauel.com/
Geofinancial Analytics,Detecting methane emissions from space and attributing them to the parties responsible.,http://www.geofinancial.com/
MindBerry,A virtual AI assistant that empowers primary care physicians to better treat mental illness,http://getmindberry.com
Lapis Health,We are a culture-first digital health treatment that safely and sustainably reverses heart disease without medication or surgery.,http://getlapishealth.com
The SnapBack,"We've built the only all-in-one, evidence based postpartum community mother's need. The function of the app is to provide an individualized rehab experience that serves as an assistant to women navigating the whirlpool that is pregnancy and postpartum, at an affordable and informative rate.",http://thesnapback.com
Redi Health,Redi.health is a health management platform which provides Pharma’s enrolled patients with simplified and impactful lifestyle tools that promote daily engagement with one’s total health. This results in increased and consistent engagement with the directly integrated Pharma Patient Support.,http://redi.health
Amalgam Rx,"Amalgam Rx is a digital health company that combines clinical and behavioral interventions through provider workflow to support patients, providers, & life sciences.",http://amalgamrx.com
Simmunome AI,"Increasing Clinical Trial Efficacy, One Disease at a Time",http://simmunome.com
Cancer Insights,"Healthcare, Oncology, Analytics",http://www.cancerinsights.com/
Cognetivity Neurosciences,"This company is a Platform technology for early, rapid and easy detection of dementia.",https://www.cognetivity.com
Quant Health,"QuantHealt’s Clinical-Simulator predicts how each patient in a clinical trial will respond to treatment, allowing research teams to optimize trial design and solve for success. Our proprietary AI-engine backed by a first-in-class dataset unlocks high-value clin-dev opportunities.",http://quanthealthlabs.com
Nanome,Nanome is a virtual reality software company that offers a collaborative VR platform for molecular modeling and structure-based drug design.,https://www.nanome.ai
"Playback Health, Inc.",Clinical multimedia creation and communication (SaaS) platform for provider-provider collaboration and provider-patient engagement.,http://playbackhealth.com
Odaia,Transforming the future of work and productivity for Pharma commercial teams to drive next-generation customer engagements.,http://odaia.ai
Singularity.AI,"We build an interactive, secure and open collaboration platform that seamlessly applies AI and the latest technologies to extract insights from images and data to accelerate and democratize medical innovation.",http://singularity.ai
Alva Health,"Our mission is to help older Americans living with high stroke risk to prevent disability, live independently, and to bring peace of mind to their families.",https://www.alva-health.com
