Company Name,Link,Description
"Sur180 Therapeutics, INC",https://www.bio.org/events/bio-international-convention/sessions/2420135,Sur180 Therapeutics is changing the way endometriosis pain and progression are treated. We are re…
Fitabeo Therapeutics,https://www.bio.org/events/bio-international-convention/sessions/2416090,"Fitabeo Therapeutics is a specialty pharmaceutical company, developing a diversified portfolio of…"
"Demeetra AgBio, Inc.",https://www.bio.org/events/bio-international-convention/sessions/2420064,Demeetra’s proprietary gene editing technologies are being applied to unique biomanufacturing…
CyteQuest,https://www.bio.org/events/bio-international-convention/sessions/2420088,"Cellular therapies, in which living cells are the drug administered to patients, have the potential…"
"Dignify Therapeutics, LLC",https://www.bio.org/events/bio-international-convention/sessions/2420079,"Dignify Therapeutics is focused on restoring voluntary control of bowel and bladder function, with…"
"Code Biotherapeutics, Inc.",https://www.bio.org/events/bio-international-convention/sessions/2416071,"Code Bio is developing transformational, non-viral, genetic medicines to treat and potentially cure…"
Quivivepharma inc,https://www.bio.org/events/bio-international-convention/sessions/2420131,No new mechanism to treat pain has been developed in the last 30 years.  We must treat pain; a…
"Plakous Therapeutics, Inc.",https://www.bio.org/events/bio-international-convention/sessions/2420105,"Plakous is a biotherapeutic company developing a patented platform that, in preclinical studies,…"
Eupraxia Pharmaceuticals,https://www.bio.org/events/bio-international-convention/sessions/2416070,"Eupraxia is a clinical-stage biotechnology company focused on the development of locally delivered,…"
Sustained Therapeutics,https://www.bio.org/events/bio-international-convention/sessions/2416088,Sustained Therapeutics is a clinical stage company developing non-opioid medicines for the…
Lahara Bio,https://www.bio.org/events/bio-international-convention/sessions/2420076,All cells respond to unique mechanical stimuli. Lahara Bio is an early-stage biotechnology company…
"Bilayer Therapeutics, Inc.",https://www.bio.org/events/bio-international-convention/sessions/2416136,Development-stage company developing first-in-class therapeutics for the treatment of chronic…
adiso therapeutics,https://www.bio.org/events/bio-international-convention/sessions/2416134,"Adiso Therapeutics, Inc. is an innovative, private, clinical-stage biopharmaceutical company…"
"Vybion, Inc",https://www.bio.org/events/bio-international-convention/sessions/2416085,Vybion is a virtual gene therapy company with Orphan Designation from the FDA for a Huntington's…
"Fzata, Inc.",https://www.bio.org/events/bio-international-convention/sessions/2416054,"Vision: Expand patient access to therapeutic biologics with oral biologics in a pill modality.

…"
Stanford Medicine,https://www.bio.org/events/bio-international-convention/sessions/2420078,"A leader in the biomedical revolution, Stanford Medicine has a long tradition of leadership in…"
Merck,https://www.bio.org/events/bio-international-convention/sessions/2429638,Merck has a strong history of success in translating cutting-edge research into life-saving medical…
SynAct Pharma,https://www.bio.org/events/bio-international-convention/sessions/2420083,SynAct Pharma AB is a clinical stage biotechnology company focused on the resolution of…
Garuda Therapeutics,https://www.bio.org/events/bio-international-convention/sessions/2416051,"Garuda is developing the world’s first, off-the-shelf hematopoietic stem cell platform that will…"
FibroBiologics,https://www.bio.org/events/bio-international-convention/sessions/2416113,"Based in Houston, FibroBiologics is a regenerative medicine company developing a pipeline of…"
Morphocell Technologies Inc.,https://www.bio.org/events/bio-international-convention/sessions/2416089,Morphocell Technologies is a regenerative medicine company developing an extensive therapeutic…
"First Wave BioPharma, Inc.",https://www.bio.org/events/bio-international-convention/sessions/2416076,First Wave BioPharma is a clinical stage biopharmaceutical company specializing in the development…
Paradigm Biopharmaceuticals,https://www.bio.org/events/bio-international-convention/sessions/2420094,Paradigm Biopharmaceuticals Ltd. (ASX:PAR) is a late-stage drug development company driven by a…
Intract Pharma,https://www.bio.org/events/bio-international-convention/sessions/2420609,Intract is a oral biologics drug delivery platform company focusing on lower gastrointestinal tract…
"Outpace Bio, Inc.",https://www.bio.org/events/bio-international-convention/sessions/2429635,Outpace is pioneering the era of curative cell therapies using protein design and cellular…
"Genentech, a Member of the Roche Group",https://www.bio.org/events/bio-international-convention/sessions/2420070,Genentech pioneered the biotech industry and revolutionized how we treat some of the world’s most…
Daré Bioscience,https://www.bio.org/events/bio-international-convention/sessions/2416133,Daré Bioscience is a biopharmaceutical company committed to advancing innovative products for women…
NIBEC,https://www.bio.org/events/bio-international-convention/sessions/2420073,"NIBEC is established as a spin-off venture from Seoul National University, South Korea at 2004 and…"
"AIVITA Biomedical, Inc.",https://www.bio.org/events/bio-international-convention/sessions/2416094,AIVITA Biomedical is a biotechnology company developing personalized vaccines for the prevention of…
"Mucommune, LLC",https://www.bio.org/events/bio-international-convention/sessions/2420139,Mucommune is a privately-held startup focused on women's reproductive health. The lead product…
Eli Lilly and Company,https://www.bio.org/events/bio-international-convention/sessions/2420101,To be added
Mediphage Bioceuticals,https://www.bio.org/events/bio-international-convention/sessions/2416030,"Mediphage, a preclinical-stage biotechnology company, is developing a next-generation non-viral…"
